naics_code,description,icp_fit_score,reasoning
3321,Forging and Stamping,35,"Forging and stamping is a heavy industrial manufacturing environment with specialized cleaning requirements beyond standard commercial services. Despite minimal OpenWorks presence (1 building, $1,750 revenue), the extremely low revenue per building ($145/month) confirms this is a DIFFICULT market - the presence indicates struggle, not success. This is a process manufacturing industry that should be avoided per the automatic penalty guidelines (cap at 40 for foundries/forging/stamping)."
3322,NAICS 3322 Industry,35,"NAICS 3322 (Cutlery and Handtool Manufacturing) is a process manufacturing industry involving metal fabrication, machining, and specialized production environments. Manufacturing facilities typically have internal facilities teams and specialized cleaning requirements beyond standard commercial cleaning. With no OpenWorks presence and only 3,642 locations nationwide, this represents a small, difficult market that doesn't align with OpenWorks' core competencies in multi-location retail, education, and operational facilities."
3323,Architectural and Structural Metals Manufacturing,35,"This is a heavy industrial manufacturing environment (metal fabrication shops, structural steel production) that falls squarely into OpenWorks' 'avoid' category for process/industrial manufacturing. Despite minimal OpenWorks presence, the revenue per building of $1,973/year ($164/month) is extremely low and confirms this is a DIFFICULT market with specialized industrial cleaning needs beyond standard commercial services. The manufacturing floor environment with metal fabrication equipment, welding operations, and industrial processes requires specialized cleaning that doesn't align with OpenWorks' core competency in standard commercial facilities."
3324,"Boiler, Tank, and Shipping Container Manufacturing",35,"This is a heavy industrial manufacturing sector involving specialized metal fabrication, welding, and production processes - a poor fit for OpenWorks' core commercial cleaning competency. Manufacturing facilities with boilers, tanks, and shipping containers require specialized industrial cleaning beyond standard janitorial services, and these process-oriented environments typically maintain internal facilities teams. The complete absence of OpenWorks revenue despite 3,500+ locations nationwide signals this is a difficult market that doesn't align with the multi-location retail, education, and operational facility sweet spots where OpenWorks succeeds."
3325,NAICS 3325 Industry,35,"NAICS 3325 (Hardware Manufacturing) represents heavy industrial/process manufacturing with specialized equipment and production environments - a category where OpenWorks consistently struggles. Metal fabrication and hardware production facilities have complex cleaning requirements beyond standard commercial services, low revenue density, and typically maintain internal facilities teams. This is a manufacturing sector to actively avoid despite being untapped, as it falls squarely into the 'process/industrial manufacturing' exclusion category with predicted poor performance."
3326,Spring and Wire Product Manufacturing,35,"Spring and wire product manufacturing is a process/industrial manufacturing environment with specialized equipment and factory floor operations - a category where OpenWorks consistently struggles. These facilities typically have heavy machinery, metal fabrication processes, and technical cleaning requirements beyond standard commercial cleaning, similar to other metal fabrication industries (NAICS 3329) that show poor revenue performance. With no current OpenWorks presence and characteristics matching proven difficult markets, this represents a low-priority opportunity that would require specialized capabilities outside OpenWorks' core competency."
3327,"Machine Shops; Turned Product; and Screw, Nut, and Bolt Manufacturing",35,"Machine shops represent heavy industrial manufacturing with specialized metalworking equipment, machining operations, and technical cleaning requirements beyond standard commercial services. Despite OpenWorks presence, the extremely low revenue per building ($1,162 annually = ~$97/month) is a critical red flag indicating this is a DIFFICULT market where OpenWorks struggles to generate meaningful revenue. This is process/industrial manufacturing that should be avoided - the minimal revenue despite presence confirms poor strategic fit."
3328,"Coating, Engraving, Heat Treating, and Allied Activities",35,"This is a manufacturing/industrial sector involving specialized metal treatment processes (coating, plating, heat treating) that falls squarely into OpenWorks' 'avoid' category. Despite having 2 locations served, the revenue per building of $2,480/month is extremely low and signals a DIFFICULT market - this is a clear example where OpenWorks presence does NOT indicate good fit. The specialized industrial environment, process manufacturing nature, and poor revenue quality make this an unattractive target despite the 18,793 nationwide locations."
3329,Other Fabricated Metal Product Manufacturing,35,"Metal fabrication is a heavy industrial manufacturing environment with specialized cleaning needs beyond standard commercial services. Despite OpenWorks presence in 5 locations, the revenue per building of $2,806/year ($234/month) is extremely low and indicates a DIFFICULT market where customers either handle cleaning internally or have minimal service needs. This is a proven poor-fit industry that should be avoided - the low revenue density despite presence confirms it requires specialized capabilities or competes on price in ways that don't align with OpenWorks' model."
3331,"Agriculture, Construction, and Mining Machinery Manufacturing",38,"This is a manufacturing industry involving heavy industrial machinery production with factory floors, specialized equipment, and likely complex safety/technical requirements beyond standard commercial cleaning. Manufacturing environments typically have internal facilities teams and specialized cleaning needs that don't align with OpenWorks' core competency in standard commercial cleaning. The lack of any current OpenWorks presence despite 15,510 locations nationwide signals this is not a natural fit for the business model."
3332,Industrial Machinery Manufacturing,35,"Industrial machinery manufacturing is a process/heavy industrial environment with specialized cleaning requirements beyond standard commercial services. Despite OpenWorks presence, the extremely low revenue per building ($1,804/building annually = $150/month) is a strong signal this is a DIFFICULT market - facilities likely have minimal cleaning needs or internal staff handle most work. This is a manufacturing environment that should be avoided despite nominal presence."
3333,Commercial and Service Industry Machinery Manufacturing,40,"Commercial and service industry machinery manufacturing is a process/industrial manufacturing environment with specialized equipment, factory floors, and technical requirements beyond standard commercial cleaning. Manufacturing facilities typically have internal facilities teams and rarely outsource cleaning as a non-core function. The lack of any OpenWorks presence despite 18,756 locations nationwide signals this is not a natural fit for the business model - if it were attractive, OpenWorks would have organically penetrated this market."
3334,"Ventilation, Heating, Air-Conditioning, and Refrigeration Equipment Manufacturing",35,"This is a manufacturing industry with heavy industrial environments, specialized equipment, and technical requirements beyond standard commercial cleaning. Despite OpenWorks presence, the extremely low revenue per building ($1,027/building annually, or ~$86/month) is a strong signal this is a DIFFICULT market - manufacturing facilities rarely outsource cleaning and have specialized needs. As a process/industrial manufacturing sector, this should be capped at 40 or below per scoring guidelines."
3335,Metalworking Machinery Manufacturing,35,"Metalworking machinery manufacturing is a process/industrial manufacturing environment with specialized cleaning requirements beyond standard commercial services. These facilities typically have heavy machinery, metal fabrication processes, and technical requirements that don't align with OpenWorks' core competency in standard commercial cleaning. The lack of any OpenWorks presence despite 16,483 locations nationwide signals this is a difficult market with low outsourcing likelihood - manufacturers typically handle facilities internally or require specialized industrial cleaning contractors."
3336,"Engine, Turbine, and Power Transmission Equipment Manufacturing",35,"This is a heavy industrial manufacturing sector producing engines, turbines, and power transmission equipment - a process/discrete manufacturing environment with specialized cleaning requirements beyond standard commercial services. Manufacturing facilities typically have internal facilities teams and require technical cleaning protocols for machinery, production floors, and potentially hazardous materials. Zero OpenWorks presence confirms this is not a natural fit - avoid manufacturing sectors that don't align with core commercial cleaning competencies."
3339,Other General Purpose Machinery Manufacturing,35,"This is a manufacturing industry with heavy machinery production, which falls outside OpenWorks' core competency. Despite having one building served, the extremely low revenue per building ($2,631 annually = $219/month) is a strong signal this is a DIFFICULT market with specialized industrial cleaning requirements. Manufacturing environments with general purpose machinery typically have complex facility needs, internal maintenance teams, and low outsourcing likelihood - the minimal revenue despite presence confirms poor strategic fit."
3341,Computer and Peripheral Equipment Manufacturing,45,"Computer and peripheral equipment manufacturing is a specialized manufacturing environment that typically requires cleanroom protocols, ESD (electrostatic discharge) controls, and technical cleaning standards beyond OpenWorks' core commercial cleaning competency. These facilities often have internal facilities management teams due to the technical nature of operations, and the lack of any OpenWorks presence despite 4,005 nationwide locations signals this is not a natural outsourcing market. While lighter than heavy industrial manufacturing, the specialized requirements and technical environment make this a challenging fit."
3342,Communications Equipment Manufacturing,45,"Communications equipment manufacturing is a specialized manufacturing environment that typically requires technical cleaning protocols and often has internal facilities teams. As a manufacturing sector with no OpenWorks presence, this represents a difficult market entry - manufacturing facilities generally have specialized requirements beyond standard commercial cleaning, and the lack of proven revenue indicates low outsourcing likelihood. While some light assembly operations might score higher, the overall manufacturing nature and technical requirements cap the score at 45."
3343,Audio and Video Equipment Manufacturing,68,"Strong proven success with excellent revenue per building ($17.7K/building, well above $5K threshold) demonstrates OpenWorks can serve this sector profitably. However, this is still manufacturing with potential specialized requirements (cleanrooms for electronics assembly, ESD protocols), and the small nationwide footprint (1,912 locations) limits scalability. Score boosted to 68 from base ~55 due to proven high-revenue performance, but capped below 75 due to manufacturing classification and technical environment concerns."
3344,Semiconductor and Other Electronic Component Manufacturing,58,"While OpenWorks shows proven revenue presence ($11K annually, $5.6K/building exceeding the $5K threshold), semiconductor manufacturing presents significant challenges: cleanroom requirements, specialized technical protocols, security clearances, and sophisticated internal facilities management teams typical of high-tech manufacturing. The revenue per building meets the threshold for a +15 boost (from base ~43 to 58), but the industry's specialized nature, technical complexity beyond standard commercial cleaning, and likelihood of internal FM departments in this capital-intensive sector cap the score at 58 despite the proven presence."
3345,"Navigational, Measuring, Electromedical, and Control Instruments Manufacturing",42,"This is a manufacturing industry with specialized technical requirements (cleanrooms, precision environments, calibration labs) that require expertise beyond standard commercial cleaning. Despite OpenWorks presence, the revenue per building of $2,408/month is extremely low, indicating a DIFFICULT market where customers likely have minimal cleaning needs or handle most internally. The specialized nature of electromedical and control instrument manufacturing, combined with poor revenue quality, makes this a challenging sector that doesn't align with OpenWorks' core competencies in standard commercial facilities."
3346,Manufacturing and Reproducing Magnetic and Optical Media,35,"Manufacturing environment with specialized production requirements for magnetic/optical media (CDs, DVDs, hard drives, etc.). This is a process manufacturing industry with technical equipment, cleanroom requirements for some products, and likely internal facilities management - all signals of poor fit for OpenWorks' standard commercial cleaning model. Zero current presence confirms this is not a natural market for OpenWorks services."
3351,Electric Lighting Equipment Manufacturing,35,"Electric lighting equipment manufacturing is a process/industrial manufacturing environment with specialized production requirements beyond standard commercial cleaning. Despite minimal OpenWorks presence (1 building, $1,072 revenue), the extremely low revenue per building ($1,072/year or ~$89/month) is a strong signal this is a DIFFICULT market - manufacturing facilities typically have internal maintenance teams or specialized cleaning needs. This falls squarely in the 'avoid manufacturing' category with factory floors, production equipment, and technical requirements that don't align with OpenWorks' core commercial cleaning competency."
3352,Household Appliance Manufacturing,35,"Household Appliance Manufacturing is a process/industrial manufacturing environment with specialized production requirements, heavy machinery, and likely internal facilities management teams - all characteristics that signal poor fit for OpenWorks' commercial cleaning model. Manufacturing facilities typically have technical cleaning needs beyond standard commercial services, and the lack of any current OpenWorks presence despite 11,949 locations nationwide suggests this industry does not outsource cleaning as a non-core function. This falls squarely into the 'avoid manufacturing' category with a score capped at 45 or lower due to industrial complexity and low outsourcing likelihood."
3353,Electrical Equipment Manufacturing,42,"Manufacturing environment with specialized equipment and technical requirements that fall outside OpenWorks' core competency. Despite OpenWorks presence, the revenue per building of $3,270/month is LOW and signals a difficult market - this is a clear indicator that electrical equipment manufacturing facilities have complex needs or procurement challenges that make them poor strategic targets. The 17% margin and minimal revenue despite 5 locations confirms this is not a scalable opportunity worth pursuing."
3359,Other Electrical Equipment and Component Manufacturing,42,"This is a manufacturing industry involving electrical equipment and components production, which falls into the 'process/industrial manufacturing' category that OpenWorks should avoid. Manufacturing facilities typically have specialized cleaning requirements, internal facilities teams, and represent difficult markets with low revenue potential per building. With no current OpenWorks presence and the industry's manufacturing nature (likely involving production lines, technical equipment, and specialized safety protocols), this represents a poor strategic fit despite the 12,789 locations nationwide."
3361,Motor Vehicle Manufacturing,35,"Motor vehicle manufacturing is a heavy industrial process environment with specialized cleaning requirements beyond standard commercial services, including factory floors with machinery, production lines, and technical protocols. This is a classic 'process manufacturing' sector that rarely outsources facilities management - automotive plants typically have internal facilities teams and union staff. Zero OpenWorks presence confirms this is not a natural fit for the business model, which succeeds in consumer-facing retail, education, and operational facilities rather than complex manufacturing environments."
3362,Motor Vehicle Body and Trailer Manufacturing,35,"Motor vehicle body and trailer manufacturing is a heavy industrial/process manufacturing environment with specialized cleaning requirements beyond standard commercial services. These facilities typically have factory floors with heavy machinery, welding operations, paint booths, and metal fabrication processes that require specialized safety protocols and technical cleaning expertise. Manufacturing environments like this rarely outsource cleaning as they often maintain internal facilities teams, and this falls squarely into the 'avoid manufacturing' category with no proven OpenWorks success to justify higher scoring."
3363,Motor Vehicle Parts Manufacturing,42,"Manufacturing environment with specialized requirements and low revenue density ($3,658/building/year = ~$305/month) despite OpenWorks presence indicates a DIFFICULT market. Auto parts manufacturing involves industrial facilities with machinery, production lines, and technical cleaning needs beyond standard commercial services. While OpenWorks has minimal presence, the poor revenue per building signals this is not a strategic fit - process manufacturing should be avoided."
3364,Aerospace Product and Parts Manufacturing,45,"Aerospace manufacturing involves highly specialized facilities with security clearances (ITAR/defense contracts), cleanroom requirements for precision parts, and technical cleaning protocols beyond standard commercial services. These facilities typically have internal facilities management teams and require specialized certifications. While some administrative offices might be serviceable, the core manufacturing environments present significant barriers including security requirements, technical specifications, and sophisticated internal FM departments common in this high-tech industrial sector."
3365,Railroad Rolling Stock Manufacturing,35,"Railroad Rolling Stock Manufacturing is a heavy industrial/process manufacturing environment with specialized cleaning requirements beyond standard commercial cleaning. These facilities involve large-scale machinery, metal fabrication, welding operations, and technical production processes that typically require internal facilities teams with specialized safety protocols. With only 646 locations nationwide and no current OpenWorks presence, this represents a difficult market with low outsourcing likelihood and specialized requirements that don't align with OpenWorks' core competency in standard commercial cleaning."
3366,Ship and Boat Building,42,"Ship and boat building is a specialized manufacturing environment with heavy industrial characteristics - fabrication facilities, welding operations, marine coatings, and technical requirements beyond standard commercial cleaning. While some administrative offices and showrooms may exist, the core production facilities involve complex manufacturing processes similar to other heavy industrial sectors that OpenWorks struggles with. The lack of current OpenWorks presence despite 3,096 locations nationwide signals low outsourcing likelihood, and this industry likely maintains internal facilities teams for specialized marine manufacturing environments."
3369,Other Transportation Equipment Manufacturing,38,"This is a manufacturing industry producing boats, motorcycles, military vehicles, and other specialized transportation equipment - a process/industrial environment with heavy machinery, specialized safety requirements, and technical cleaning needs beyond standard commercial services. Manufacturing facilities typically have internal facilities teams and rarely outsource cleaning as a non-core function. The lack of any OpenWorks presence despite 2,550 nationwide locations signals this is not a natural fit for the business model, and the specialized nature of transportation equipment manufacturing (aerospace components, defense vehicles, marine vessels) creates barriers similar to other avoided manufacturing sectors."
3371,Household and Institutional Furniture Manufacturing,42,"Furniture manufacturing is a discrete manufacturing environment with factory floors, production equipment, and assembly operations - not OpenWorks' core competency in standard commercial cleaning. While less complex than process industries like chemicals or paper mills, manufacturing facilities typically have internal facilities teams and specialized cleaning requirements beyond basic janitorial services. The lack of any OpenWorks presence despite 67,832 locations nationwide signals this is not a natural fit for the business model, and furniture manufacturing doesn't align with the proven success profile of multi-location retail, education, or operational facilities where cleaning is clearly outsourced as non-core."
3372,Office Furniture Manufacturing,42,"Office furniture manufacturing is a process/light manufacturing environment that falls into OpenWorks' challenging category. While not as heavy industrial as chemical plants or paper mills, furniture manufacturing facilities typically have production floors with machinery, finishing areas with specialized requirements (paint booths, wood dust), and often maintain internal facilities teams. The lack of any OpenWorks presence despite 5,309 locations nationwide signals low outsourcing likelihood in this sector, and manufacturing environments generally score poorly for OpenWorks' standardized commercial cleaning model."
3379,Other Furniture Related Product Manufacturing,38,"This is a manufacturing industry involving furniture-related products (blinds, shades, mattresses, etc.), which falls into the 'process/industrial manufacturing' category that OpenWorks struggles with. Manufacturing facilities typically have specialized cleaning requirements, internal facilities teams, and low outsourcing likelihood for non-core services. With no current OpenWorks presence and the inherent challenges of manufacturing environments, this represents a difficult market with limited strategic fit."
3391,Medical Equipment and Supplies Manufacturing,45,"Medical equipment manufacturing presents significant challenges despite being untapped. This is a specialized manufacturing environment requiring cleanroom protocols, FDA/GMP compliance, and sterile manufacturing standards that exceed OpenWorks' core commercial cleaning competency. The industry likely maintains internal facilities teams for quality control and regulatory compliance, making outsourcing unlikely for critical production areas, though administrative offices might be accessible."
3399,NAICS 3399 Industry,38,"NAICS 3399 covers miscellaneous manufacturing (including metal products, industrial equipment, and specialized manufacturing). Despite OpenWorks presence with 10 buildings, the revenue per building of $3,922/month is below the $5K threshold that indicates a healthy market, signaling this is a DIFFICULT manufacturing environment with specialized requirements. Manufacturing industries with low revenue density should be avoided - the presence indicates struggle, not success."
4231,NAICS 4231 Industry,42,"Motor vehicle and parts wholesale distribution represents a challenging market despite OpenWorks presence. The extremely low revenue per building ($1,865/building annually, or ~$155/month) indicates these are difficult accounts with minimal cleaning needs or pricing pressure - this is a clear signal of poor market fit despite having 3 locations. Wholesale distribution facilities typically have utilitarian warehouse environments with limited cleaning requirements, and the poor revenue quality confirms this industry should be avoided rather than pursued."
4232,NAICS 4232 Industry,55,"NAICS 4232 (Furniture and Home Furnishing Merchant Wholesalers) represents wholesale distribution facilities - warehouses and showrooms that distribute furniture to retailers. While these are operational facilities that may outsource cleaning (warehousing/distribution is non-core), wholesale operations typically have lower cleaning intensity than retail, and the industry lacks the multi-location retail chain characteristics that drive OpenWorks' highest success. Without proven OpenWorks performance data and given the wholesale (B2B) rather than consumer-facing nature, this scores as moderate fit - worth exploring but not a priority target like retail chains or education."
