naics_code,description,icp_fit_score,reasoning
5182,"Data Processing, Hosting, and Related Services",85,"Data centers and hosting facilities are PROVEN operational environments where OpenWorks succeeds - 24/7 operations requiring round-the-clock facility support with utilitarian cleaning needs. The $18,594 revenue from 3 locations demonstrates these facilities outsource cleaning as a non-core function, and the industry's technical focus (servers/data) means cleaning is clearly support infrastructure. Strong fit for multi-location data center operators and cloud hosting companies without sophisticated internal FM teams, though some large tech companies may have corporate facilities departments."
5192,"Book, Periodical, and Newspaper Merchant Wholesalers",35,"NAICS 5192 (Book, Periodical, and Newspaper Merchant Wholesalers) represents a declining industry with limited multi-location potential and poor strategic fit. These are typically small wholesale operations (book distributors, magazine wholesalers) with minimal facility footprints and low cleaning needs. Zero OpenWorks presence despite 53,908 locations signals this industry does not outsource cleaning - likely handling minimal needs internally or operating from small warehouses where cleaning is not a priority spend."
5211,Monetary Authorities-Central Bank,25,"Federal Reserve banks and central banking facilities represent highly specialized government operations with stringent security clearances, federal procurement processes, and likely internal facilities management teams. Zero OpenWorks presence despite 3,410 locations nationwide is a strong signal that these facilities either maintain internal cleaning staff or use specialized government contractors with security clearances. The combination of government bureaucracy, security requirements, and complete absence of proven success makes this a poor strategic fit for OpenWorks' commercial cleaning model."
5221,Depository Credit Intermediation (Banks),72,"Strong proven success with $129K revenue and 109 buildings demonstrates banks DO outsource cleaning despite being financial services. The $1,187/building revenue and 15.5% margin show profitable operations. Score capped at 72 due to industry pattern of larger banks having internal FM departments and corporate contracts, but proven performance warrants solid rating - likely serving regional/community banks and branch networks rather than major headquarters."
5222,Nondepository Credit Intermediation,62,"Nondepository credit intermediation (consumer lending, mortgage brokers, credit card processing) includes many small office locations that outsource cleaning, as evidenced by OpenWorks serving 8 buildings. However, the very low revenue per building ($542) suggests these are small offices with minimal cleaning needs, and the industry includes many single-location operations rather than the ideal multi-location chains. The proven success warrants a moderate score, but limited growth potential per location and fragmented market structure prevent a higher rating."
5223,Activities Related to Credit Intermediation,45,"Financial services industry with professional office environments that typically have internal facilities management departments or national cleaning contracts. Zero OpenWorks presence despite 114,841 locations is a strong RED FLAG - indicates this industry manages facilities internally or uses enterprise-level contracts rather than outsourcing to regional providers. While multi-location potential exists, the lack of any proven success suggests poor outsourcing likelihood and misalignment with OpenWorks' operational/industrial sweet spot."
5231,Securities and Commodity Contracts Intermediation and Brokerage,35,"Securities and brokerage firms typically operate professional office environments with sophisticated internal facilities management teams or national corporate cleaning contracts. Zero OpenWorks presence despite 190,060 locations is a strong RED FLAG - this indicates the industry either doesn't outsource to regional providers or has entrenched national contracts. These are corporate headquarters and branch offices with 'VP of Facilities' roles, not the operational/industrial facilities where OpenWorks succeeds."
5232,Securities and Commodity Exchanges,35,"Securities and commodity exchanges represent highly specialized financial infrastructure with sophisticated internal facilities management, security protocols, and likely national cleaning contracts through corporate procurement. The complete absence of OpenWorks presence despite 645 locations nationwide is a strong signal that this industry maintains internal FM teams or uses enterprise-level service providers. These are typically Fortune 500-scale operations (NYSE, NASDAQ, CME) with complex security clearances and professional office environments that don't align with OpenWorks' operational facility sweet spot."
5239,Other Financial Investment Activities,58,"While OpenWorks has minimal proven presence (2 buildings, $4,942 revenue), this financial investment sector typically consists of professional offices with sophisticated facilities management or national cleaning contracts. The very low revenue per building ($2,471) and small footprint suggest these are likely small satellite offices rather than the corporate headquarters that dominate this NAICS code. Score reflects proven outsourcing (+5 points for minimal revenue) but tempered by industry pattern of internal FM teams and professional office environments that typically don't align with OpenWorks' operational facility sweet spot."
5241,Insurance Carriers,35,"Insurance carriers represent professional office environments where corporate headquarters typically maintain internal facilities management departments or national cleaning contracts. Zero OpenWorks presence despite 79,000+ locations is a strong RED FLAG - this indicates insurance companies either handle cleaning internally or use enterprise-level national contracts that OpenWorks cannot compete for. The professional office nature, sophisticated FM infrastructure, and complete absence of proven success make this a poor strategic fit despite the large location count."
5242,"Agencies, Brokerages, and Other Insurance Related Activities",35,"Insurance agencies and brokerages are professional office environments that typically maintain internal facilities management or use national cleaning contracts through corporate real estate departments. Zero OpenWorks presence despite 741K+ locations is a strong RED FLAG - this massive market would show some penetration if outsourcing to regional providers was common. These are exactly the type of professional services firms (like banks, securities firms) that prefer established national vendors or internal staff over regional commercial cleaning providers."
5251,Insurance and Employee Benefit Funds,35,"NAICS 5251 (Insurance and Employee Benefit Funds) represents insurance carriers, pension funds, and benefit trust funds - typically corporate office environments with sophisticated internal facilities management teams or national cleaning contracts. Zero OpenWorks presence despite 7,351 locations nationwide is a strong RED FLAG indicating these organizations don't outsource to regional providers like OpenWorks. These are financial institutions with professional office settings that prefer large national vendors or have internal FM departments, making them poor strategic targets."
5259,Other Investment Pools and Funds,45,"NAICS 5259 (Other Investment Pools and Funds) represents financial services firms managing investment vehicles - typically professional office environments with sophisticated corporate infrastructure. Zero OpenWorks presence despite being a professional services sector is a red flag, suggesting these firms either have internal facilities management teams or use national cleaning contracts through corporate real estate departments. The financial services nature and likely Fortune 500/institutional scale makes this a poor fit for OpenWorks' mid-market, multi-location operational facility model."
5311,Lessors of Real Estate,72,"Real estate lessors show proven OpenWorks success ($119K revenue, 39 buildings) indicating outsourcing likelihood, but this is a mixed category requiring careful segmentation. Strong fit for property management companies managing multi-location portfolios (office parks, retail centers, industrial properties) where cleaning is outsourced to tenant-serving lessors. However, many lessors are small landlords or pass cleaning responsibility to tenants, and large REITs often have sophisticated internal facilities teams or national contracts, limiting addressable market despite proven revenue."
5312,Offices of Real Estate Agents and Brokers,68,"Real estate offices represent a moderate fit with proven OpenWorks success ($48K revenue, 14 locations) demonstrating outsourcing viability in this sector. The massive market size (439K+ locations) and multi-location brokerage firms align with ICP, though many are small independent offices. Score boosted from base 60 to 68 due to proven revenue, but capped below 75 as these are professional office environments where larger brokerages may have corporate FM arrangements and smaller offices have minimal cleaning needs."
5313,Activities Related to Real Estate,72,"Strong proven success with $56K revenue and 25 buildings demonstrates real outsourcing in this sector. Property management companies and real estate offices are multi-location operators that outsource cleaning as non-core, though some larger REITs may have internal FM teams. The $2,240/building revenue and solid margins indicate good operational fit, earning +10 proven success bonus and benefiting from multi-location nature of property management firms."
5321,Automotive Equipment Rental and Leasing,45,"NAICS 5321 (Automotive Equipment Rental and Leasing) includes car rental agencies, truck rental, and equipment leasing facilities. While OpenWorks has minimal presence ($3,323 revenue, 3 buildings), these are typically small retail/counter locations with limited cleaning needs and often handled by staff. The low revenue per building ($1,108) suggests small facilities or minimal service scope, and this industry typically doesn't outsource cleaning as a strategic priority - most locations are small storefronts or lots where cleaning is incidental rather than a core facility need."
5322,NAICS 5322 Industry,45,"Consumer Goods Rental (equipment rental, party/event rental, formal wear rental) represents a challenging fit for OpenWorks. While multi-location rental chains exist, these are typically smaller retail/showroom environments with limited square footage and often owner-operated with internal cleaning. The complete absence of OpenWorks revenue despite 64,370 locations nationwide is a strong signal that this industry either handles cleaning internally or has minimal outsourcing needs - rental businesses prioritize equipment maintenance over facility services and rarely view cleaning as a strategic outsourcing opportunity."
5323,General Rental Centers,45,"NAICS 5323 (General Rental Centers) includes equipment rental businesses with showrooms, warehouses, and maintenance facilities that could theoretically need cleaning services. However, the complete absence of OpenWorks presence despite 33,380 nationwide locations is a strong RED FLAG - this suggests the industry either handles cleaning internally, has minimal facility needs, or doesn't prioritize outsourced cleaning. Without proven success data and given the likely small-footprint retail/warehouse hybrid nature of these facilities, this represents a speculative market with uncertain outsourcing likelihood."
5324,Commercial and Industrial Machinery and Equipment Rental and Leasing,72,"NAICS 5324 (Commercial and Industrial Machinery and Equipment Rental and Leasing) shows proven OpenWorks success with 13 locations served, demonstrating this industry outsources cleaning as a non-core function. These are operational/industrial facilities (equipment yards, rental centers, service facilities) that align well with OpenWorks' strength in utilitarian environments. Score boosted from base 65 to 72 due to proven revenue generation, though limited to mid-70s as these are typically smaller-footprint facilities with moderate cleaning needs rather than the large-scale operations where OpenWorks excels most."
5331,Lessors of Nonfinancial Intangible Assets,35,"NAICS 5331 (Lessors of Nonfinancial Intangible Assets) covers companies that lease intellectual property like patents, trademarks, and franchises - not physical facilities. This industry has minimal facility footprint beyond small corporate offices, making it a poor fit for commercial cleaning services. Zero OpenWorks presence confirms these businesses don't outsource cleaning at scale."
5411,Legal Services,45,"Legal services represents professional office environments where firms typically have sophisticated facilities management or national cleaning contracts. Despite minimal OpenWorks presence ($3K revenue, 3 buildings), this is a highly fragmented market (479K locations) dominated by small law firms that may outsource. However, the extremely low revenue per building ($1K/year) and lack of scale suggests these are very small offices or occasional services, not the multi-location operational facilities where OpenWorks excels. Professional services firms prioritize appearance/prestige and often have established vendor relationships that are difficult to displace."
5412,"Accounting, Tax Preparation, Bookkeeping, and Payroll Services",45,"Despite minimal OpenWorks presence ($786 revenue, 1 building), this is a professional services industry where firms typically operate small offices with limited cleaning needs. Accounting/tax firms often have internal staff handle basic cleaning or use local janitorial services rather than outsourcing to multi-location providers. The single-location success likely represents a small local firm rather than a scalable multi-location opportunity, and the industry lacks the operational facility characteristics where OpenWorks excels."
5413,"Architectural, Engineering, and Related Services",68,"OpenWorks has proven success serving 11 A&E firm locations, demonstrating these professional offices do outsource cleaning. However, this is a professional services environment where larger firms often have internal facilities management or national contracts, limiting scalability. The $1,809/building revenue suggests smaller offices rather than large multi-location firms, indicating opportunities exist primarily in the regional/mid-market segment rather than major engineering corporations."
5414,Specialized Design Services,35,"Specialized Design Services (architecture, interior design, graphic design firms) are typically small professional offices with minimal facility footprints and sophisticated aesthetic standards. Zero OpenWorks presence despite 95,783 locations is a strong signal that these firms either handle cleaning internally, use boutique services, or have minimal cleaning needs. These are professional service environments that prioritize appearance/prestige and likely prefer specialized providers or have internal arrangements - not the operational/industrial facilities where OpenWorks excels."
5415,Computer Systems Design and Related Services,45,"Computer systems design firms typically operate from professional office environments where cleaning is often handled through corporate facilities management or national office cleaning contracts. Zero OpenWorks presence despite 169,625 locations nationwide is a RED FLAG - this suggests the industry either maintains internal FM teams, uses national contracts, or has low outsourcing propensity. While some smaller tech firms and regional IT service providers might outsource, the lack of any proven success indicates this is not a natural fit for OpenWorks' operational/industrial facility strength."
5416,"Management, Scientific, and Technical Consulting Services",45,"Professional consulting firms typically operate from corporate office environments and often have internal facilities management or national cleaning contracts through corporate real estate departments. Zero OpenWorks presence despite 452K+ locations is a RED FLAG - this suggests low outsourcing likelihood to regional providers like OpenWorks. While some smaller multi-location consulting firms might outsource, the professional office nature and lack of proven success indicates this is not a strategic priority market."
5417,Scientific Research and Development Services,48,"Despite minimal OpenWorks presence ($3.4K revenue, 2 buildings), scientific R&D facilities present significant challenges: many require specialized cleanroom protocols, biosafety compliance, and hazardous material handling beyond standard commercial cleaning. The low revenue per building ($1,724) and minimal penetration suggest these are likely administrative offices rather than lab facilities. While some R&D companies outsource office cleaning, core lab environments typically require specialized vendors or internal staff with technical training, making this a poor strategic fit for expansion despite the large market size."
5418,"Advertising, Public Relations, and Related Services",48,"Despite minimal proven success ($3,397 revenue, 3 buildings), advertising/PR agencies are professional office environments that typically have internal facilities management or national cleaning contracts. The extremely low revenue per building ($1,132) and small footprint suggest these are small agencies without multi-location operations. This industry represents professional services firms that don't align with OpenWorks' operational/industrial sweet spot, and the lack of meaningful revenue despite 408K+ locations nationwide signals poor outsourcing fit for standard commercial cleaning."
5419,"Other Professional, Scientific, and Technical Services",68,"OpenWorks has proven success with $47K revenue across 20 locations, demonstrating this industry does outsource cleaning services. However, the low revenue per building ($2,351) suggests smaller facilities or limited scope engagements. This broad NAICS category (5419) includes diverse professional services firms that may have varying outsourcing patterns - some are multi-location operators ideal for OpenWorks, while others are single-office professional firms with less attractive economics. The proven presence earns a solid score, but the fragmented nature and professional office environment prevents a higher rating without more multi-location operational facilities."
5511,Management of Companies and Enterprises,35,"Management of Companies (holding companies, corporate headquarters) represents professional office environments with sophisticated internal facilities management departments and national cleaning contracts. Zero OpenWorks presence despite 39,442 locations is a strong RED FLAG - these are exactly the corporate headquarters with VPs of Facilities that manage cleaning in-house or through enterprise agreements. This is the antithesis of OpenWorks' sweet spot: Fortune 500/large corporate environments where cleaning decisions are made by facilities professionals, not operational managers seeking to outsource non-core functions."
5611,Office Administrative Services,62,"Office Administrative Services represents professional office environments that typically outsource cleaning as non-core. However, minimal OpenWorks presence ($5.8K revenue, 1 building) despite 53K+ nationwide locations suggests limited multi-location concentration or strong competition from national office cleaning contracts. The proven outsourcing likelihood earns a moderate score, but lack of scale indicates this isn't a priority growth segment compared to operational/industrial facilities where OpenWorks demonstrates stronger traction."
5612,Facilities Support Services,45,"Despite proven OpenWorks success ($70K revenue, 7 buildings), this NAICS represents facilities management COMPETITORS, not customers. These are companies that provide facility support services themselves - they ARE the cleaning/maintenance providers, not businesses that outsource cleaning. This is a competitor category, not a target market, making it strategically inappropriate despite the revenue data suggesting some edge cases where facility support companies outsource their own office cleaning."
5613,Employment Services,62,"Employment Services (staffing agencies, temp agencies, recruiting firms) represents a moderate fit with proven but minimal OpenWorks presence ($1,628 from 1 location). These are typically professional office environments where cleaning is outsourced as non-core, and the 78,138 locations suggest multi-location operators exist. However, the extremely low revenue despite proven presence indicates small office footprints, limited cleaning needs, or strong competition from national office cleaning contracts - this is more of a small professional office play than OpenWorks' operational facility sweet spot."
5614,Business Support Services,72,"Business Support Services shows proven OpenWorks success with $43K revenue across 7 locations, demonstrating outsourcing likelihood and multi-location fit. However, this broad category includes diverse facility types from call centers (strong fit) to professional office environments (weaker fit), and the moderate revenue per building ($6,201) suggests smaller facilities or mixed operational complexity. Score reflects proven success bonus (+10) balanced against industry heterogeneity and potential presence of professional office segments with internal FM capabilities."
5615,Travel Arrangement and Reservation Services,45,"Travel agencies are typically small professional office environments (1-5 employees per location) with minimal cleaning needs and low outsourcing likelihood. Zero OpenWorks presence despite 78K+ locations nationwide is a strong RED FLAG - this suggests the industry either handles cleaning internally or uses local residential-style services rather than commercial contracts. The fragmented, small-office nature and lack of proven success makes this a poor strategic fit despite the location count."
5616,Investigation and Security Services,45,"Investigation and security services firms operate offices, training facilities, and operations centers that could need cleaning, but this industry faces significant challenges for OpenWorks. Zero current presence despite 105K+ locations is a RED FLAG - security firms likely handle facilities in-house (security-conscious culture), have minimal facility footprints (field-based workforce), or use vetted vendors due to access/clearance concerns. The lack of any OpenWorks penetration suggests low outsourcing propensity and poor strategic fit despite the location count."
5617,Services to Buildings and Dwellings,15,"This NAICS code represents OpenWorks' direct COMPETITORS - janitorial services, carpet cleaning, window cleaning, and other building service contractors. These are service providers, not facility owners/operators who would hire OpenWorks. Zero presence confirms these are competitors, not customers. This industry should be excluded from target market analysis."
5619,Other Support Services,45,"NAICS 5619 is a catch-all category covering diverse support services (travel agencies, convention services, repossession, court reporting, etc.) with highly variable facility types and cleaning needs. Zero OpenWorks presence despite 118,921 locations signals this is NOT a natural outsourcing market - likely small offices, home-based businesses, or operations with minimal facility footprints. The heterogeneous nature makes it difficult to target systematically, and absence of any proven success suggests poor strategic fit for OpenWorks' multi-location operational facility model."
5621,Waste Collection,85,"Strong proven success with $67K revenue across 59 locations demonstrates waste collection facilities actively outsource cleaning. These operational/industrial facilities (transfer stations, fleet maintenance, sorting facilities) have utilitarian cleaning needs that align perfectly with OpenWorks' core competency - heavy-duty, non-specialized cleaning for blue-collar operational environments. The 27K+ nationwide locations offer significant expansion potential in a sector where OpenWorks has already validated product-market fit."
5622,Waste Treatment and Disposal,62,"Waste treatment and disposal facilities share operational characteristics with proven OpenWorks success in waste collection (5621), featuring industrial facilities, 24/7 operations, and utilitarian cleaning needs. However, zero current OpenWorks presence despite 29,367 locations suggests potential barriers - likely specialized cleaning requirements (hazmat protocols, contamination control) or internal facilities staff at larger operators. Score reflects moderate potential in smaller/regional operators with standard facility areas, but caution warranted given lack of proven success in this specific segment."
5629,Remediation and Other Waste Management Services,68,"Remediation and waste management facilities represent operational/industrial environments where cleaning is a non-core support function, aligning well with OpenWorks' proven success in waste collection (5621). However, the minimal current presence ($1K revenue, 1 building) suggests limited penetration despite 47,543 potential locations, and some facilities may have specialized hazmat/contamination protocols beyond standard commercial cleaning. The industry shows promise for operational facilities (transfer stations, equipment yards) but requires careful qualification to avoid specialized remediation sites requiring technical expertise."
