naics_code,description,icp_fit_score,reasoning
5221,Depository Credit Intermediation (Banks),58,"Banks have multi-location branch networks that align with OpenWorks' model, but the extremely low revenue per building ($1,187/building annually = ~$99/month) indicates this is a DIFFICULT market despite OpenWorks presence. Banks typically have corporate facilities management teams and national cleaning contracts, making them hard to penetrate at scale. The proven low revenue density signals challenging procurement dynamics and limited growth potential, preventing this from scoring higher despite the multi-location fit."
5222,Nondepository Credit Intermediation,42,"Despite OpenWorks presence, the extremely low revenue per building ($542/building annually, ~$45/month) is a strong signal this is a DIFFICULT market. Nondepository credit intermediation includes consumer lending, mortgage brokers, and financial services offices that typically have small footprints, professional office environments, and minimal cleaning needs. The low revenue density despite 8 locations served indicates these are challenging accounts that don't align with OpenWorks' ideal multi-location retail/operational facility model."
5223,Activities Related to Credit Intermediation,45,"Credit intermediation support activities (loan brokers, check cashing, mortgage brokers, financial transaction processing) typically operate in small professional office environments with limited facility footprints and often have corporate facilities management for multi-location operators. While the large location count (114K+) suggests fragmentation, these are predominantly small offices where cleaning is either handled internally or through local vendors, and larger operators likely have national contracts or internal FM teams. No OpenWorks presence indicates low outsourcing propensity in this financial services segment."
5231,Securities and Commodity Contracts Intermediation and Brokerage,45,"Securities and brokerage firms typically operate professional office environments with internal facilities management teams or national cleaning contracts through corporate real estate departments. These are sophisticated financial services organizations (often Fortune 500 or large regional firms) with centralized procurement and 'VP of Facilities' roles, making them difficult to penetrate at the local franchise level. While the large location count suggests scale, the lack of OpenWorks presence indicates low outsourcing likelihood to regional cleaning providers, and the professional office nature doesn't align with OpenWorks' strength in retail chains, education, and operational facilities."
5232,Securities and Commodity Exchanges,45,"Securities and commodity exchanges represent highly specialized financial infrastructure with sophisticated corporate facilities management teams and stringent security/compliance requirements. These are typically large institutional operators (NYSE, CME, NASDAQ) with internal FM departments or national cleaning contracts, making them difficult to penetrate. The small market size (645 locations) and professional office environment with complex security protocols place this outside OpenWorks' core competency of multi-location retail, education, and operational facilities."
5239,Other Financial Investment Activities,42,"Financial investment firms typically have sophisticated internal facilities management or national cleaning contracts, making them difficult to penetrate. Despite OpenWorks presence, the extremely low revenue per building ($2,471/year or ~$206/month) indicates these are very small offices or difficult accounts that don't align with OpenWorks' multi-location model. This is a professional services sector where cleaning is often handled through corporate real estate departments rather than outsourced at the local level."
5241,Insurance Carriers,45,"Insurance carriers typically operate corporate offices and regional headquarters with sophisticated internal facilities management teams or national cleaning contracts, making them difficult to penetrate. While they have multi-location branch networks, the professional office environment and centralized procurement through corporate real estate/facilities departments creates barriers to entry. The lack of OpenWorks presence despite 79,000+ locations nationwide signals this is not a natural fit - insurance companies view facilities as a corporate function rather than outsourcing to regional providers like OpenWorks."
5242,"Agencies, Brokerages, and Other Insurance Related Activities",45,"Insurance agencies and brokerages are predominantly professional office environments with small footprints (typically 1-5 person offices or small branch locations). While some regional insurance carriers might have multi-location operations, the industry is characterized by independent agents, small brokerages, and corporate offices that likely have internal FM teams or national cleaning contracts. The lack of OpenWorks presence despite 741K+ locations signals low outsourcing likelihood to regional providers like OpenWorks - these are either too small (single-location offices) or too sophisticated (corporate carriers with procurement departments)."
5251,NAICS 5251 Industry,55,"NAICS 5251 (Insurance and Employee Benefit Funds) represents insurance carriers, pension funds, and benefit trust funds - primarily corporate office environments. While these are multi-location operators with 7,351 facilities nationwide, they typically have sophisticated internal facilities management teams or national cleaning contracts at the corporate level, making them challenging to penetrate. The lack of OpenWorks presence suggests limited outsourcing opportunity, and these professional office environments don't align with OpenWorks' sweet spot of retail chains, education, and operational facilities."
5259,NAICS 5259 Industry,45,"NAICS 5259 (Other Investment Pools and Funds) represents financial services firms managing investment vehicles - typically professional office environments with sophisticated corporate facilities management teams. These are headquarters/corporate offices where cleaning is often handled through national contracts or internal FM departments, making them difficult to penetrate. Without proven OpenWorks success and facing strong internal FM capabilities, this represents a challenging market with low outsourcing likelihood to regional providers."
5311,Lessors of Real Estate,62,"Real estate lessors (property management companies, REITs, landlords) present a mixed opportunity. While OpenWorks has proven presence ($119K revenue, 39 buildings), the low revenue per building ($3,060/month) indicates these are likely smaller office buildings or properties where the lessor manages common areas only, not full facility cleaning. This is a fragmented market of property owners/managers who may handle cleaning in-house or have tenant-specific arrangements, making it challenging to scale despite the large location count. The moderate score reflects proven but limited revenue potential rather than the high-value multi-location retail or education opportunities that drive OpenWorks' best performance."
5312,Offices of Real Estate Agents and Brokers,45,"Real estate offices are typically small professional office environments (1-5 agents per location) that rarely outsource cleaning, with most handling it internally or using individual contractors. The low revenue per building ($3,440/year = $287/month) despite OpenWorks presence confirms this is a difficult, low-value market. While the industry is stable and has massive location count, these are predominantly single-location small businesses or franchises without centralized procurement, making them a poor strategic fit for OpenWorks' multi-location B2B model."
5313,Activities Related to Real Estate,45,"Despite OpenWorks presence with 25 buildings, the revenue per building of $2,240/building ($187/month) is extremely low and signals a DIFFICULT market. Real estate offices (property management firms, brokerages, title companies) are typically small professional offices with minimal cleaning needs and price sensitivity. This is a poor strategic fit - the low revenue density indicates these are small-footprint offices that don't align with OpenWorks' multi-location facility model, and the industry consists primarily of independent operators rather than chains with centralized procurement."
5321,NAICS 5321 Industry,45,"Despite being a target industry (automotive equipment rental with multi-location operators), OpenWorks' extremely low revenue per building ($1,108 annually = $92/month) indicates this is a DIFFICULT market with minimal cleaning needs or pricing pressure. The 172,200 locations suggest many small single-location operators rather than the multi-location chains OpenWorks targets. While rental facilities should outsource cleaning, the poor revenue quality signals this industry doesn't value or require substantial facility maintenance services."
5322,NAICS 5322 Industry,72,"Consumer Goods Rental (party/event equipment, formal wear, general consumer rentals) represents a solid multi-location opportunity. These businesses operate consumer-facing retail locations requiring regular cleaning and presentation standards, typically outsource facilities management as non-core, and often have regional chains with centralized operations. While not as strong as automotive rental (5321) due to smaller average footprints and more fragmented operators, the 64,370 locations indicate substantial market size with many multi-location operators in party rental, costume/formal wear, and equipment rental segments."
5323,NAICS 5323 Industry,72,"General Rental Centers (equipment rental for construction, industrial, homeowner use) represent a solid multi-location opportunity similar to automotive rental (5321). These facilities require regular cleaning of showrooms, customer areas, and equipment storage/maintenance spaces, and operators typically outsource cleaning as non-core. The industry is stable with regional chains and franchise operations that fit OpenWorks' multi-location model, though not as high-priority as retail chains or education."
5324,NAICS 5324 Industry,35,"NAICS 5324 (Commercial and Industrial Machinery and Equipment Rental and Leasing) represents a challenging market despite OpenWorks presence. The extremely low revenue per building ($751/building annually, or ~$63/month) indicates these are difficult accounts with minimal cleaning needs - likely small rental yards or equipment storage facilities rather than customer-facing retail locations. This is a poor-fit industrial/operational segment where cleaning is minimal and revenue density is unsustainably low, making it strategically unattractive despite the 37,808 nationwide locations."
5331,NAICS 5331 Industry,45,"NAICS 5331 (Lessors of Nonfinancial Intangible Assets) covers companies that lease intellectual property like patents, trademarks, and franchising rights - these are primarily administrative/office operations without significant physical facilities requiring cleaning services. This industry has minimal facility footprints and no multi-location operational facilities that would benefit from OpenWorks' services. The lack of OpenWorks presence combined with the intangible nature of the business model indicates poor strategic fit for commercial cleaning services."
5411,Legal Services,35,"Legal services represents professional office environments that typically have internal facilities management or national cleaning contracts, making them difficult to penetrate. Despite OpenWorks presence in 3 locations, the extremely low revenue per building ($1,006/building annually, or ~$84/month) is a strong signal this is a DIFFICULT market - law firms either handle cleaning internally or have established vendor relationships that are hard to displace. The fragmented nature (479K locations) suggests mostly small single-office practices rather than the multi-location chains OpenWorks targets."
5412,"Accounting, Tax Preparation, Bookkeeping, and Payroll Services",35,"Professional services firms like accounting practices typically have single-location offices or small regional operations, not the multi-location chains OpenWorks targets. The extremely low revenue per building ($786/year = $65/month) despite presence confirms this is a DIFFICULT market - likely small professional offices with minimal cleaning needs or strong preference for local providers. These firms often handle facilities internally or use local cleaning services, and lack the centralized procurement that makes multi-location operators attractive."
5413,"Architectural, Engineering, and Related Services",45,"Professional services firms typically have small office footprints with minimal cleaning needs, reflected in the very low revenue per building ($1,809/building vs. target $5K+/month). These are single-location professional offices or small firms that rarely operate multi-location networks with centralized procurement - the fragmented market structure (301K locations) and low revenue density indicate this is a difficult, low-value segment despite OpenWorks presence. Architecture and engineering firms often have internal office management or use local janitorial services rather than outsourcing to facility service providers."
5414,Specialized Design Services,45,"Specialized Design Services (architecture, interior design, graphic design firms) are typically small professional offices with minimal facility footprints and sophisticated internal management. These are single-location or small multi-location professional service firms that often handle facilities in-house or through existing corporate relationships. The industry lacks the multi-location retail/operational characteristics that drive OpenWorks' success, and professional service firms typically don't view cleaning as a strategic outsourcing opportunity requiring specialized vendor management."
5415,Computer Systems Design and Related Services,55,"Computer systems design firms typically operate professional office environments that may have internal facilities management or national cleaning contracts, especially larger tech companies. While some multi-location IT services firms and smaller tech offices could be targets, the industry skews toward knowledge workers in corporate settings where cleaning is often handled through building management or corporate FM departments. The lack of OpenWorks presence suggests limited outsourcing opportunity, and the professional office nature makes this a moderate-fit market requiring careful prospect selection for mid-market, multi-location operators without sophisticated FM teams."
5416,"Management, Scientific, and Technical Consulting Services",45,"Professional consulting firms typically operate in corporate office environments with internal facilities management or national cleaning contracts, making them difficult to penetrate. These are knowledge-worker businesses where cleaning is handled through building management or corporate FM departments, not outsourced to regional providers. Zero OpenWorks presence despite 452K+ locations signals this is not a natural fit - consulting firms don't match the multi-location retail/operational facility profile where OpenWorks succeeds."
5417,Scientific Research and Development Services,42,"Scientific R&D facilities typically have specialized cleaning requirements (labs, cleanrooms, hazmat protocols) beyond standard commercial cleaning, and often maintain internal facilities teams for compliance and security. Despite OpenWorks presence, the extremely low revenue per building ($1,724/building annually = $144/month) is a STRONG NEGATIVE SIGNAL indicating this is a difficult market with minimal cleaning spend or highly competitive pricing. The specialized technical nature of research facilities (biotech labs, chemical research, sterile environments) creates barriers that limit OpenWorks' ability to capture meaningful revenue, making this a poor strategic fit despite the large nationwide footprint."
5418,"Advertising, Public Relations, and Related Services",35,"Despite OpenWorks presence, the extremely low revenue per building ($1,132/year or ~$94/month) is a strong signal this is a DIFFICULT market. Advertising/PR agencies are typically professional office environments with small footprints, often in shared office buildings with landlord-provided cleaning, and rarely operate as multi-location chains with centralized procurement. The minimal revenue despite presence indicates these are likely small, one-off accounts that don't fit OpenWorks' multi-location model."
5419,"Other Professional, Scientific, and Technical Services",45,"Professional services firms typically have sophisticated internal facilities management or national cleaning contracts, making them difficult to penetrate. While OpenWorks has some presence ($47K revenue), the very low revenue per building ($2,351/building annually = $196/month) indicates these are challenging accounts with minimal service scope - likely small professional offices rather than multi-location operators. This is a fragmented, low-value market that doesn't align with OpenWorks' multi-location retail and operational facility strengths."
5511,Management of Companies and Enterprises,35,"Management of Companies and Enterprises (5511) represents corporate headquarters and holding companies that manage other entities - these are professional office environments that typically have sophisticated internal facilities management teams or national cleaning contracts already in place. This is a 'VP of Facilities' environment where centralized procurement and internal FM departments are the norm, making it difficult to penetrate and unlikely to outsource to regional operators like OpenWorks. The lack of any current OpenWorks presence despite 39,442 locations nationwide signals this is not a natural fit for the business model."
5611,Office Administrative Services,52,"Office Administrative Services represents professional office environments that typically serve other businesses (administrative support, document prep, telephone answering services). While OpenWorks has minimal presence ($5,822 from 1 building), these are small professional offices that may lack centralized procurement and are not multi-location operators. The industry doesn't align with OpenWorks' sweet spot of multi-location retail chains, education, or operational facilities - these are fragmented single-location professional service providers unlikely to have standardized facility needs or centralized decision-making."
5612,Facilities Support Services,45,"Despite strong revenue per building ($10K/month), this industry represents facilities management COMPETITORS, not customers. NAICS 5612 includes janitorial services, security services, and other facilities support providers - these are service companies that compete with or complement OpenWorks, not multi-location businesses that would outsource cleaning. The revenue likely comes from cleaning their own offices, not strategic accounts."
5613,Employment Services,35,"Employment services (staffing agencies, temp agencies, HR consultancies) are typically small professional office environments with minimal cleaning needs and low revenue density, as evidenced by OpenWorks' $1,628 annual revenue from 1 building ($136/month). These are single-location or small multi-location professional offices that likely handle cleaning internally or use local vendors, not the type of multi-location operational facilities where OpenWorks excels. The extremely low revenue per building despite presence confirms this is a difficult, low-value market segment."
5614,Business Support Services,78,"Strong proven success with $6,201/building revenue demonstrating effective service delivery in this sector. Business support services (call centers, collection agencies, telemarketing) operate multi-location facilities with standardized cleaning needs and consistently outsource as non-core. The industry's operational focus and OpenWorks' solid performance metrics indicate excellent strategic fit, though not quite top-tier like retail chains or education."
5615,Travel Arrangement and Reservation Services,45,"Travel agencies and reservation services are typically small, single-location offices with minimal facility footprints and low cleaning needs. The industry lacks multi-location operators with centralized procurement, and most businesses are small independent agencies or home-based operations. While some corporate travel management companies exist, the fragmented nature of this industry (78K+ locations suggests many small operators) and limited facility requirements make it a poor strategic fit for OpenWorks' multi-location model."
5616,Investigation and Security Services,45,"Investigation and security services firms typically operate small office environments with minimal cleaning needs, and many are single-location or small multi-location operators. The industry consists largely of professional services firms (private investigators, security consultants, guard services) that may handle cleaning internally or have minimal facility requirements. While some larger security companies operate multiple branch offices, the lack of OpenWorks presence suggests limited outsourcing appetite, and these are not the high-traffic, consumer-facing, or operational facilities where OpenWorks excels."
5617,Services to Buildings and Dwellings,15,"This NAICS code represents OpenWorks' direct COMPETITORS - janitorial services, landscaping, pest control, and other building service contractors. These are service providers like OpenWorks itself, not potential customers who would outsource cleaning. This is the supply side of the market, not the demand side, making it completely unsuitable as a target customer segment."
5619,Other Support Services,45,"NAICS 5619 is a catch-all category covering diverse support services (travel agencies, convention services, repossession, court reporting, etc.) with no clear facility profile or multi-location patterns. The heterogeneous nature makes it difficult to target systematically, and many subsectors are small professional offices or service businesses without significant cleaning needs. Without proven OpenWorks success and unclear outsourcing patterns across such varied operations, this represents a speculative opportunity requiring subsector analysis rather than a strategic priority."
5621,Waste Collection,78,"Waste Collection (5621) represents a strong operational fit with proven OpenWorks success generating $67K annually across 59 locations. These are blue-collar operational facilities (transfer stations, fleet maintenance yards, collection depots) where cleaning is clearly non-core and outsourced, aligning perfectly with OpenWorks' operational facility expertise. However, the relatively low revenue per building ($1,146/building annually, ~$95/month) suggests smaller facilities or limited scope work, preventing a higher score despite the proven track record and 27K+ nationwide locations offering significant scale potential."
5622,Waste Treatment and Disposal,72,"Waste treatment and disposal facilities (transfer stations, recycling centers, landfill operations) represent operational/industrial facilities that align well with OpenWorks' blue-collar operational cleaning strengths. These are utilitarian facilities requiring heavy-duty cleaning (fleet maintenance areas, equipment bays, administrative offices) where cleaning is clearly non-core, and operators often run multi-location networks. Similar to proven success in waste collection (5621), these facilities need consistent maintenance but lack the specialized hazardous material protocols that would disqualify them - score reflects strong operational fit but slightly lower than retail/education due to heavier industrial environment and need to verify multi-location concentration."
5629,Remediation and Other Waste Management Services,72,"Strong operational fit as waste management facilities (transfer stations, recycling centers, fleet maintenance) require heavy-duty cleaning and operate 24/7 with utilitarian needs - cleaning is clearly non-core. However, the extremely low revenue per building ($1,074 annually = $89/month) despite OpenWorks presence is a major red flag indicating difficult market conditions, pricing pressure, or limited scope opportunities. The large nationwide footprint (47,543 locations) and proven waste collection success (5621) suggest potential, but current performance prevents a higher score until revenue quality improves significantly."
6111,Elementary and Secondary Schools,95,"Elementary and Secondary Schools (K-12) represents an IDEAL target market for OpenWorks with exceptional proven performance ($910K revenue, $5,550/building - well above threshold). School districts are multi-location operators with centralized decision-making, always outsource cleaning as non-core, and require consistent facility maintenance across standardized buildings. The massive nationwide footprint (230,965 locations) combined with strong existing performance and the education sector's stability makes this a top-tier strategic priority."
6112,Junior Colleges,85,"Junior colleges are an excellent strategic fit as educational institutions that consistently outsource cleaning as a non-core function. Multi-campus community college systems offer centralized decision-making, standardized facility types, and high cleaning frequency needs across classrooms, labs, cafeterias, and student centers. As a TOP TIER education target with 7,299 locations nationwide and zero current OpenWorks presence, this represents a significant untapped opportunity in a stable, mission-critical sector that aligns perfectly with OpenWorks' multi-location operational model."
