naics_code,description,icp_fit_score,reasoning
4594,NAICS 4594 Industry,35,"NAICS 4594 appears to be an invalid/placeholder code (standard NAICS codes are 6 digits, not 4). Without knowing the actual industry, cannot assess fit. If this represents a retail or consumer-facing business category, OpenWorks typically struggles in retail environments due to after-hours scheduling complexity, high turnover, and preference for internal staff or regional cleaning companies. Zero current presence despite large location count (159,539) is a strong negative signal suggesting poor outsourcing likelihood or misalignment with OpenWorks' operational facility focus."
4595,NAICS 4595 Industry,35,"NAICS 4595 appears to be a container/packaging materials merchant wholesaler category. This represents a poor strategic fit for OpenWorks due to zero proven success despite 72,000+ locations nationwide - a strong signal that these businesses either handle cleaning internally or have minimal facility needs. Wholesale distribution facilities typically have basic operational cleaning requirements but often manage this in-house as part of warehouse operations, and the complete absence of OpenWorks presence suggests low outsourcing propensity in this sector."
4599,NAICS 4599,0,"NAICS 4599 is not a valid industry code in the standard NAICS classification system. The 45xx series covers Retail Trade, but 4599 does not exist as a defined category. Without a valid industry definition, it's impossible to assess outsourcing likelihood, facility types, or strategic fit for OpenWorks' commercial cleaning services."
4811,Scheduled Air Transportation,45,"Scheduled Air Transportation presents significant challenges for OpenWorks despite multi-location potential. Airlines require security clearances (TSA/airport access), have specialized cleaning protocols for aircraft and terminals, and typically maintain internal facilities teams or use national contracts with aviation-specific vendors. Zero OpenWorks presence despite being a professional, multi-location industry is a strong signal that outsourcing to regional providers is unlikely - this sector demands specialized capabilities beyond standard commercial cleaning."
4812,"Nonscheduled Air Transportation - charter flights, air ambulances, scenic tours",45,"NAICS 4812 (Nonscheduled Air Transportation - charter flights, air ambulances, scenic tours) presents significant challenges for OpenWorks. These operations typically involve specialized aviation facilities requiring security clearances, FAA compliance, and technical cleaning protocols beyond standard commercial services. The complete absence of OpenWorks presence despite 4,406 locations nationwide is a strong signal that this industry either maintains internal facilities staff or requires specialized aviation service providers, making it a poor strategic fit for OpenWorks' core commercial cleaning model."
4821,Rail Transportation,85,"Rail Transportation is a PROVEN SUCCESS industry for OpenWorks with $717K revenue across 936 locations, demonstrating strong outsourcing patterns for operational facilities like stations, maintenance yards, and terminals. These are utilitarian, multi-location operations where cleaning is non-core, fitting OpenWorks' sweet spot perfectly. The negative margin suggests pricing optimization opportunities, but the substantial existing footprint (26% market penetration) validates this as a strategic target industry with room for profitable growth."
4831,"Deep Sea, Coastal, and Great Lakes Water Transportation",45,"Deep sea and coastal water transportation presents significant challenges for OpenWorks' model. These facilities (ports, terminals, marine operations) often require specialized maritime cleaning protocols, security clearances, and have complex operational environments with union labor considerations. The small market size (410 locations nationwide) combined with zero current OpenWorks presence despite operational facility characteristics suggests either high barriers to entry or poor outsourcing likelihood - likely both given maritime industry's tendency toward internal facilities management and specialized requirements."
4832,Inland Water Transportation,45,"NAICS 4832 (Inland Water Transportation) includes ferry services, tugboat operations, and barge transportation - specialized maritime operations with unique facility requirements including docks, marine terminals, and vessel maintenance facilities. Zero OpenWorks presence despite 11,923 locations nationwide is a significant red flag, suggesting these operations either handle cleaning internally (maritime crew/staff) or require specialized marine facility expertise beyond standard commercial cleaning. The maritime environment, safety regulations, and operational complexity make this a challenging fit without proven success indicators."
4841,General Freight Trucking,85,"General Freight Trucking is a PROVEN SUCCESS industry for OpenWorks with $66K revenue across 37 locations, demonstrating strong outsourcing patterns. These operational facilities (terminals, distribution centers, fleet maintenance) have utilitarian cleaning needs where cleaning is clearly non-core, and the multi-location nature (83K+ nationwide locations) provides excellent expansion potential. The $1,785/building revenue and 15% margin confirm sustainable service delivery in this blue-collar operational environment."
4842,NAICS 4842 Industry,72,"Specialized freight trucking (moving, storage, courier services) shows proven OpenWorks success with 2 locations served, demonstrating outsourcing viability in this operational sector. While the low revenue per building ($1,170) suggests smaller facilities or limited scope compared to general freight trucking (4841), the 109,848 nationwide locations represent significant expansion potential. Score reflects proven fit in transportation/logistics operations but tempered by smaller facility footprint and lower revenue density compared to general freight terminals and warehouses."
4851,Urban Transit Systems,72,"Urban transit systems (bus terminals, rail stations, maintenance facilities) represent strong operational facilities with 24/7 cleaning needs and multi-location potential. Similar to proven success in rail transportation (4821) and trucking terminals (4841), these are utilitarian facilities where cleaning is a non-core support function. However, public sector procurement processes, union considerations, and potential internal facilities staff create moderate barriers, preventing a higher score despite the operational fit."
4852,Interurban and Rural Bus Transportation,45,"NAICS 4852 (Interurban and Rural Bus Transportation) presents moderate challenges for OpenWorks. While these operators have terminals and maintenance facilities requiring cleaning, the industry is characterized by smaller regional operators with limited multi-location presence, often running lean operations with internal staff. The complete absence of OpenWorks revenue despite 4,287 locations nationwide suggests low outsourcing propensity in this sector, likely due to cost sensitivity and preference for internal maintenance teams at bus depots."
4853,"Taxi and limousine services operate dispatch centers, vehicle maintenance facilities, and fleet garages that require regular commercial cleaning - operational facilities where cleaning",72,"Taxi and limousine services operate dispatch centers, vehicle maintenance facilities, and fleet garages that require regular commercial cleaning - operational facilities where cleaning is non-core. While individual taxi operators are too small, fleet operators and limousine companies with multiple locations (dispatch centers, maintenance bays, driver facilities) fit OpenWorks' multi-location model. The complete absence of OpenWorks presence despite 32,000+ locations suggests untapped potential in mid-sized fleet operators, though fragmentation and small independent operators present challenges."
4854,School and Employee Bus Transportation,72,"School and Employee Bus Transportation represents a strong operational fit for OpenWorks - these are multi-location fleet facilities (bus depots, maintenance garages, driver facilities) with utilitarian cleaning needs and 24/7 operations similar to proven success in trucking (4841) and rail (4821). The industry outsources non-core facility maintenance, operates regional fleets with centralized management, and lacks sophisticated internal FM departments. Zero current OpenWorks presence despite strong theoretical fit suggests untapped opportunity in an operationally-focused transportation sector where cleaning is clearly non-core."
4855,Charter Bus Industry,45,"NAICS 4855 (Charter Bus Industry) presents moderate challenges for OpenWorks. While these are operational facilities (bus terminals, maintenance garages) that could outsource cleaning, the industry is highly fragmented with many small operators, and the lack of any current OpenWorks presence despite 5,570 locations suggests limited outsourcing appetite. Transportation facilities can be good fits, but charter bus operations tend to be smaller-scale with less sophisticated facility needs compared to proven successes like freight trucking terminals or rail facilities."
4859,Other Transit and Ground Passenger Transportation,45,"NAICS 4859 (Other Transit and Ground Passenger Transportation) includes diverse services like limousines, shuttles, and charter buses. While some operators have multi-location facilities (garages, dispatch centers), the industry is fragmented with many small operators, and OpenWorks has zero proven success here despite the operational nature. The lack of any current presence in a transportation-adjacent sector (unlike proven success in trucking/rail) suggests either limited multi-location concentration or preference for internal/specialized cleaning, warranting a cautious moderate score until market validation occurs."
4861,NAICS 4861 Industry,45,"Pipeline transportation (oil, gas, water) involves specialized industrial facilities with technical requirements and safety protocols that may exceed standard commercial cleaning capabilities. Zero OpenWorks presence despite 4,387 locations suggests either limited outsourcing (internal maintenance teams common in utilities/energy) or specialized requirements that don't align with core competencies. Without proven success in similar pipeline/utility operations, this represents a speculative market with uncertain outsourcing likelihood and potential technical barriers."
4862,Pipeline transportation of natural gas,75,"Pipeline transportation of natural gas represents operational/industrial facilities (compressor stations, metering facilities, control centers) that align well with OpenWorks' operational facility expertise. These are 24/7 operations with utilitarian cleaning needs where facility maintenance is non-core, and the multi-location nature of pipeline networks (stations along routes) fits the ideal customer profile. While no current OpenWorks presence exists, the operational/industrial characteristics mirror proven success categories like trucking terminals and warehousing, though the specialized energy sector and potential union considerations warrant moderate caution."
4869,Other Pipeline Transportation,45,"NAICS 4869 (Other Pipeline Transportation) represents specialized infrastructure operations with only 898 locations nationwide, indicating a niche market with limited scale potential. While these are operational facilities that may outsource cleaning, the specialized nature of pipeline operations (safety protocols, remote locations, potential security requirements) and tiny market size make this a low-priority opportunity. Zero OpenWorks presence despite operational characteristics suggests either limited outsourcing or poor fit for standard commercial cleaning services."
4871,"Scenic and Sightseeing Transportation, Land",45,"NAICS 4871 (Scenic and Sightseeing Transportation, Land) includes tour buses, trolleys, and sightseeing operations - typically small operators with limited facilities beyond vehicle storage/maintenance. With only 673 locations nationwide and zero OpenWorks presence, this suggests very low outsourcing likelihood as these are often owner-operated businesses with minimal facility footprints. The lack of proven success despite being an accessible market indicates poor strategic fit for OpenWorks' multi-location commercial cleaning model."
4872,"Scenic and Sightseeing Transportation, Water",35,"NAICS 4872 (Scenic and Sightseeing Transportation, Water) represents tourist boat operations, ferries, and water tours - a highly specialized niche with seasonal operations, small facility footprints (docks/terminals), and marine-specific cleaning requirements. Zero OpenWorks presence despite 10,948 locations nationwide is a strong signal that these operators either handle cleaning internally or require specialized marine/waterfront services beyond standard commercial cleaning. The seasonal nature, small operational facilities, and lack of multi-location operators make this a poor strategic fit."
4879,"Scenic and Sightseeing Transportation, Other",45,"NAICS 4879 (Scenic and Sightseeing Transportation, Other) includes specialized tourism operations like aerial tramways, cable cars, and sightseeing vessels. While these are operational facilities that could outsource cleaning, the small market size (3,821 locations nationwide), highly seasonal nature, and often remote/specialized locations make this a challenging market. Zero OpenWorks presence despite operational characteristics suggests limited outsourcing likelihood or difficult-to-serve facilities."
4881,Support Activities for Air Transportation,55,"While OpenWorks has minimal proven presence ($6,440 from 1 building), this industry faces significant challenges including security clearance requirements at airports, specialized operational environments, and complex procurement processes. The industry includes diverse facilities from FBOs to ground handling operations, but many require technical protocols beyond standard commercial cleaning. Score capped at 55 due to specialized requirements, though minimal existing revenue prevents complete disqualification."
4882,Support Activities for Rail Transportation,45,"NAICS 4882 (Support Activities for Rail Transportation) includes rail yards, maintenance facilities, and switching operations - operational environments that align with OpenWorks' blue-collar facility strengths. However, zero current OpenWorks presence despite 28,088 locations nationwide is a significant red flag, suggesting these facilities likely have internal maintenance teams, union considerations, or are managed by parent rail companies with centralized facilities departments. The complete absence of proven success indicates substantial barriers to entry that override theoretical operational fit."
4883,Support Activities for Water Transportation,68,"OpenWorks has proven success serving 4 water transportation support facilities (ports, marinas, terminals), demonstrating these operations do outsource cleaning. However, the low revenue per building ($2,718) suggests smaller facilities or limited scope, and the industry's specialized maritime environment (salt exposure, dock facilities, security requirements) creates complexity beyond standard commercial cleaning. Score boosted to 68 from base ~55 due to proven outsourcing (+5 for revenue presence, +8 for operational/industrial fit), but capped below 70 due to specialized maritime requirements and small facility footprint limiting growth potential."
4884,Support Activities for Road Transportation,62,"Support Activities for Road Transportation (truck stops, weigh stations, fleet maintenance facilities, dispatching centers) represents operational facilities that should outsource cleaning as non-core. However, zero OpenWorks presence despite 53,027 locations is a significant red flag - this suggests either fragmented ownership (many single-location operators), internal cleaning staff, or facilities that don't prioritize professional cleaning services. Score reflects moderate potential but tempered by lack of proven success and uncertainty about multi-location concentration and outsourcing patterns in this sector."
4885,Freight Transportation Arrangement,72,"Freight transportation arrangement (freight forwarders, logistics brokers) represents a solid fit with proven OpenWorks success serving 4 locations. These are operational facilities (warehouses, distribution centers, offices) where cleaning is non-core, and the industry includes multi-location operators. Score reflects proven outsourcing (+5 bonus), operational facility fit, and strong market size (57,850 locations), though revenue per building is modest at $2,185 suggesting smaller facilities or limited scope."
4889,Other Support Activities for Transportation,45,"NAICS 4889 (Other Support Activities for Transportation) covers diverse support services including freight forwarding, packing/crating, and transportation arrangement. While some segments like freight terminals and logistics facilities could fit OpenWorks' operational facility profile, the industry's heterogeneity and lack of proven OpenWorks success signals uncertain outsourcing patterns. The zero current presence despite 3,678 locations suggests either limited multi-location operators, internal cleaning preferences, or facilities that don't match OpenWorks' sweet spot - warranting cautious exploration rather than aggressive pursuit."
4911,Postal Service,35,"NAICS 4911 (Postal Service) represents a challenging market for OpenWorks despite the large location count. The U.S. Postal Service operates as a government entity with centralized procurement, union facilities staff, and likely has national contracts or internal cleaning teams for its post offices and distribution centers. Zero OpenWorks presence despite 43,000+ locations is a strong signal that this industry either doesn't outsource cleaning or has entrenched national providers, making it a poor strategic fit for a regional commercial cleaning franchise."
4921,Couriers and Express Delivery Services,45,"NAICS 4921 (Couriers and Express Delivery Services) represents package delivery operations like FedEx/UPS facilities. While OpenWorks has minimal presence ($864 revenue, 1 building), this industry typically has internal facilities teams at major carriers or uses national contracts. The operational/logistics nature fits OpenWorks' strengths, but limited market penetration despite 7,257+ locations suggests strong incumbent relationships or internal management preferences that make displacement difficult."
4922,NAICS 4922 Industry,85,"Natural gas distribution facilities (pipeline operations, compressor stations, maintenance yards) are operational/industrial environments where cleaning is a non-core support function - ideal for outsourcing. These utilities typically operate multiple facilities across service territories with 24/7 operations requiring consistent facility maintenance, and the utilitarian nature of these facilities aligns perfectly with OpenWorks' operational cleaning expertise. Zero current presence despite strong theoretical fit suggests an untapped opportunity in a stable, regulated industry with predictable facility needs."
4931,Warehousing and Storage,88,"Warehousing represents an IDEAL operational facility type for OpenWorks with proven success ($95K revenue, 36 buildings). These large-footprint, 24/7 operational facilities treat cleaning as a non-core support function and typically lack sophisticated internal FM departments. The combination of proven performance, massive market size (118K locations), and perfect alignment with OpenWorks' operational facility expertise makes this a top-tier strategic opportunity."
5121,Motion Picture and Video Industries,85,"Strong proven success with $275K revenue across 40 locations demonstrates excellent fit. Production studios, post-production facilities, and entertainment venues align perfectly with OpenWorks' operational facility expertise - these are 24/7 operations requiring round-the-clock facility support where cleaning is clearly a non-core function. The solid revenue per building ($6,872) and healthy 14.9% margin confirm this is a sustainable, profitable segment with significant expansion potential given only 40 of 33,977 nationwide locations currently served."
5122,Sound Recording Industries,45,"NAICS 5122 (Sound Recording Industries) includes recording studios, music production facilities, and post-production operations. While these are operational facilities that could outsource cleaning, the complete absence of OpenWorks presence despite 10,000+ locations nationwide is a significant red flag - suggesting either highly specialized facility requirements, small facility footprints, or strong preference for internal/local cleaning arrangements. Without proven success in similar entertainment production environments, this represents a speculative market with uncertain outsourcing patterns."
5131,"Book Publishers, Directory/Mailing List Publishers, Newspaper/Periodical Publishers",45,"NAICS 5131 (Book Publishers, Directory/Mailing List Publishers, Newspaper/Periodical Publishers) represents professional office environments where cleaning is typically managed through corporate facilities departments or national contracts. Despite minimal OpenWorks presence ($2,852 from 1 building), this industry shows poor strategic fit - publishing companies operate professional offices with sophisticated internal FM teams, not the operational/industrial facilities where OpenWorks excels. The single building served likely represents an outlier rather than scalable opportunity in this white-collar sector."
5132,"NAICS 5132 covers cable and satellite programming/broadcasting networks, which",45,"NAICS 5132 covers cable and satellite programming/broadcasting networks, which are typically professional media facilities with specialized technical requirements and corporate facilities management. While OpenWorks has minimal presence ($6K revenue, 3 buildings), this likely represents small regional offices rather than core broadcast facilities. The low revenue per building ($2,114) and limited penetration suggest these are not ideal customers - media companies often have internal FM teams or require specialized cleaning protocols for technical equipment areas, making this a challenging market for expansion despite the proven foothold."
5161,Internet Publishing and Broadcasting/Web Search Portals,45,"NAICS 5161 (Internet Publishing and Broadcasting/Web Search Portals) represents professional office environments for tech companies, which typically have sophisticated internal facilities management or national cleaning contracts. Despite minimal OpenWorks presence ($1,605 revenue, 1 building), this industry shows poor outsourcing fit - tech companies either handle facilities internally or use enterprise-level providers. The professional office nature and likely presence of facilities departments makes this a challenging market for OpenWorks' multi-location operational facility model."
5162,"Book, Periodical, and Newspaper Merchant Wholesalers",35,"NAICS 5162 (Book, Periodical, and Newspaper Merchant Wholesalers) represents a declining industry with limited multi-location potential and no proven OpenWorks success. These are typically small-footprint warehouse/distribution operations in a sector facing digital disruption, making them poor strategic targets. The complete absence of OpenWorks presence despite 3,804 locations nationwide signals low outsourcing likelihood and poor fit with OpenWorks' operational facility strengths."
5171,Wired and Wireless Telecommunications Carriers,62,"Telecommunications carriers operate operational facilities (cell towers, switching stations, network operations centers) that align with OpenWorks' operational facility strength, and proven revenue from 3 buildings confirms outsourcing occurs. However, the very low revenue per building ($1,048) suggests these are small facilities or limited scope contracts, and the industry includes both large national carriers with sophisticated FM departments and smaller regional operators - the proven success appears limited to smaller-scale opportunities rather than the multi-location operational facilities where OpenWorks excels."
5174,Satellite Telecommunications,35,"NAICS 5174 (Satellite Telecommunications) represents a highly specialized technical industry with only 269 locations nationwide, indicating limited scale opportunity. These facilities typically require specialized technical cleaning protocols for sensitive equipment and often have internal facilities management teams due to the critical nature of operations. The complete absence of OpenWorks presence despite the professional/technical nature suggests this industry either handles cleaning internally or requires specialized capabilities beyond standard commercial cleaning services."
5178,Other Telecommunications,35,"NAICS 5178 (Other Telecommunications) includes telecom resellers, satellite communications, and specialized telecom services - typically professional office environments with corporate facilities management teams. Zero OpenWorks presence despite 61,968 locations is a RED FLAG indicating low outsourcing likelihood, likely due to internal FM departments or national cleaning contracts at corporate headquarters. These are professional office settings where cleaning is managed centrally, not operational facilities where OpenWorks excels."
