naics_code,description,icp_fit_score,reasoning
1111,NAICS 1111 Industry,25,"NAICS 1111 represents Oilseed and Grain Farming - agricultural production operations that are fundamentally incompatible with OpenWorks' commercial cleaning model. These are outdoor farming operations (fields, silos, grain elevators) with minimal commercial building footprint, highly seasonal operations, and no standardized facility cleaning needs. Agricultural operations manage their own facilities and have no tradition of outsourcing cleaning services - this is a non-target market with no multi-location facility management opportunity."
1112,NAICS 1112 Industry,25,"NAICS 1112 covers cattle ranching and feedlots - agricultural operations with outdoor/barn facilities that have specialized cleaning needs (animal waste, feed areas, veterinary standards) far beyond OpenWorks' commercial cleaning competency. These are typically owner-operated farms or agricultural businesses that handle facility maintenance internally, not multi-location chains that outsource cleaning. This is a poor strategic fit - agricultural operations don't align with OpenWorks' core commercial cleaning model for retail, education, and operational facilities."
1113,NAICS 1113 Industry,25,"NAICS 1113 covers fruit and tree nut farming - agricultural operations including orchards, groves, and vineyards. This is a poor fit for OpenWorks as these are outdoor agricultural facilities with specialized cleaning needs (packing houses, processing areas) rather than standard commercial buildings. The industry involves seasonal operations, dispersed rural locations, and typically handles facility maintenance internally rather than outsourcing to commercial cleaning services."
1114,NAICS 1114 Industry,25,"NAICS 1114 covers greenhouse, nursery, and floriculture production - agricultural operations with specialized growing environments, irrigation systems, and horticultural requirements that fall outside OpenWorks' core commercial cleaning competency. These are production facilities (agriculture/farming) rather than consumer-facing retail or operational facilities, with cleaning needs tied to plant care and growing processes rather than standard commercial maintenance. The agricultural nature, specialized requirements, and lack of multi-location chains make this a poor strategic fit despite the facility count."
1119,NAICS 1119 Industry,25,"NAICS 1119 covers 'Other Crop Farming' including tobacco, hay, peanuts, sugar crops, and specialty crops. This is agricultural production with outdoor/field operations, not commercial buildings requiring standard cleaning services. These are working farms with minimal facility footprints, no multi-location chains, and cleaning needs limited to small office/storage buildings - fundamentally misaligned with OpenWorks' commercial facility maintenance model."
1121,NAICS 1121 Industry,25,"NAICS 1121 covers cattle ranching and feedlots - agricultural operations that are fundamentally incompatible with OpenWorks' commercial cleaning model. These are outdoor agricultural facilities (pastures, feedlots, barns) requiring specialized agricultural maintenance rather than standard commercial cleaning services. The industry involves livestock operations with specialized sanitation needs, manure management, and agricultural protocols that fall completely outside OpenWorks' core competency in commercial facility cleaning."
1122,NAICS 1122 Industry,25,"NAICS 1122 covers hog and pig farming operations - agricultural production facilities with specialized biosecurity, waste management, and sanitation requirements far beyond standard commercial cleaning. These are rural farming operations with 440 total locations nationwide (extremely small market), typically owner-operated with internal staff handling facility maintenance, and cleaning needs are agricultural/veterinary in nature rather than commercial janitorial services. This is a poor strategic fit - agricultural production is outside OpenWorks' core competency of multi-location commercial facilities."
1123,NAICS 1123 Industry,25,"NAICS 1123 covers poultry and egg production - agricultural operations including hatcheries, chicken farms, and egg production facilities. These are specialized agricultural/industrial environments with biosecurity protocols, animal waste management, and sanitation requirements far beyond standard commercial cleaning. The small market size (1,720 locations nationwide) and highly specialized nature of agricultural facility maintenance make this a poor strategic fit for OpenWorks' core commercial cleaning competencies."
1124,NAICS 1124 Industry,25,"NAICS 1124 covers sheep and goat farming operations - agricultural production facilities that are fundamentally incompatible with OpenWorks' commercial cleaning model. These are outdoor farming operations with barns/shelters requiring specialized agricultural cleaning (manure removal, livestock sanitation) rather than standard commercial facility maintenance. With only 275 total locations nationwide and highly specialized requirements, this represents a very poor strategic fit for OpenWorks' core competencies in multi-location commercial cleaning."
1125,NAICS 1125 Industry,25,"NAICS 1125 represents aquaculture operations (fish farms, shellfish farming, hatcheries), which are specialized agricultural/production facilities with unique environmental and biosecurity requirements beyond standard commercial cleaning. These are typically single-location operations with small facility footprints relative to production areas, and cleaning needs are highly specialized (water quality, disease prevention, food safety protocols) rather than standard janitorial services. The industry lacks the multi-location retail/operational profile that drives OpenWorks success, and the 2,408 total U.S. locations indicate a small, fragmented market without the scale or standardization needed for strategic focus."
1129,NAICS 1129 Industry,25,"NAICS 1129 covers 'Other Animal Production' including apiculture (beekeeping), aquaculture, fur-bearing animals, horses/equine production, and rabbits. These are agricultural/farming operations with specialized facility requirements (barns, hatcheries, kennels) that fall outside OpenWorks' core commercial cleaning competency. Agricultural facilities typically have owner-operators who handle their own maintenance, lack multi-location standardization, and require specialized knowledge of animal husbandry environments rather than standard commercial cleaning services."
1131,NAICS 1131 Industry,25,"NAICS 1131 (Timber Tract Operations) represents forestry/logging operations - outdoor, natural resource extraction environments that are fundamentally incompatible with OpenWorks' commercial cleaning model. With only 177 locations nationwide, this is an extremely small market of specialized operations (timber harvesting, forest management) that have no standard commercial facility cleaning needs and would not outsource such services. This is a clear avoid - wrong environment, wrong industry type, and minimal addressable market."
1132,NAICS 1132 Industry,25,"NAICS 1132 (Forest Nurseries and Gathering of Forest Products) represents outdoor agricultural/forestry operations with minimal built facilities - primarily nurseries, tree farms, and forest product gathering operations. These are not multi-location commercial facilities requiring regular cleaning services; they are outdoor agricultural operations with limited building infrastructure. This industry falls far outside OpenWorks' core competency of commercial facility maintenance for multi-location businesses with standardized indoor spaces."
1133,NAICS 1133 Industry,25,"NAICS 1133 covers logging operations - a heavy industrial, outdoor extraction industry with specialized equipment and safety requirements far beyond standard commercial cleaning. These are not multi-location facilities with consumer-facing needs; they're remote forestry operations with minimal building infrastructure and cleaning needs handled internally by operational staff. This represents a poor strategic fit with no proven OpenWorks success and extremely low likelihood of outsourcing facility maintenance."
1141,NAICS 1141 Industry,25,"NAICS 1141 covers fishing operations (commercial fishing, shellfish farming, fish hatcheries), which are highly specialized operational environments with unique cleaning and maintenance requirements beyond standard commercial cleaning. With only 616 locations nationwide, this is an extremely small market with facilities that likely handle their own maintenance internally or require specialized marine/aquaculture expertise. This industry represents a poor strategic fit - specialized requirements, tiny addressable market, and no evidence of outsourcing cleaning as a non-core function."
1142,NAICS 1142 Industry,25,"NAICS 1142 covers hunting and trapping operations - a highly specialized agricultural/outdoor activity with minimal facility infrastructure and no alignment with OpenWorks' commercial cleaning model. These operations typically consist of outdoor land areas, hunting preserves, or small rustic facilities that don't require professional commercial cleaning services. This represents a fundamentally poor fit with zero multi-location potential and no outsourcing culture for facility maintenance."
1151,NAICS 1151 Industry,25,"NAICS 1151 covers support activities for crop production (farm labor contractors, soil preparation, crop harvesting services). This is agricultural/farming support - highly seasonal, geographically dispersed operations, not multi-location facilities requiring commercial cleaning. These are outdoor agricultural operations, not the type of commercial buildings where OpenWorks provides janitorial services."
1152,NAICS 1152 Industry,25,"NAICS 1152 covers aquaculture operations (fish farms, shellfish farming, hatcheries), which are specialized agricultural/production facilities with unique environmental and biosecurity requirements far beyond standard commercial cleaning. These are process-oriented operations with technical cleaning protocols related to water quality, disease prevention, and food safety that require specialized expertise, not general janitorial services. This is a niche agricultural sector that would not outsource to commercial cleaning providers like OpenWorks."
1153,NAICS 1153 Industry,25,"NAICS 1153 covers support activities for forestry (logging support, forest nurseries, timber tract operations). This is a heavy industrial/outdoor operational environment with specialized requirements far outside OpenWorks' core commercial cleaning competency. These are not multi-location retail or facility-based operations requiring standard janitorial services - they're forestry/logging support operations with minimal indoor facility needs and highly specialized outdoor/industrial cleaning requirements that don't align with OpenWorks' service model."
2111,NAICS 2111 Industry,25,"Oil and gas extraction (NAICS 2111) is a heavy industrial sector with highly specialized facility requirements including hazardous materials handling, environmental compliance, and technical safety protocols far beyond standard commercial cleaning. These operations typically have internal facilities teams and require specialized contractors with industry-specific certifications and insurance. This is a process industry with complex operational environments that falls well outside OpenWorks' core competency of standard commercial cleaning for multi-location retail, education, and operational facilities."
2121,NAICS 2121 Industry,25,"NAICS 2121 covers coal mining operations - a heavy industrial/extraction industry with specialized safety requirements, hazardous environments, and technical cleaning needs far beyond standard commercial services. This is a declining industry facing secular headwinds (transition away from coal), with only 762 locations nationwide indicating limited market opportunity. Mining operations typically have internal facilities teams and require specialized protocols that don't align with OpenWorks' core commercial cleaning competency."
2122,NAICS 2122 Industry,25,"NAICS 2122 covers metal ore mining operations - a heavy industrial/extraction industry with specialized safety requirements, remote locations, and complex operational environments far outside OpenWorks' core competency in standard commercial cleaning. Mining operations typically have internal facilities teams and require specialized cleaning protocols for industrial equipment, hazardous materials, and harsh environments. With only 246 locations nationwide and no current OpenWorks presence, this represents a difficult market with low outsourcing likelihood and poor strategic fit."
2123,Nonmetallic Mineral Mining,35,"Nonmetallic mineral mining (quarries, sand/gravel pits, stone mining) represents heavy industrial operations with specialized safety requirements, hazardous environments, and process-oriented facilities that fall outside OpenWorks' core competency in standard commercial cleaning. These operations typically have internal facilities teams managing specialized cleaning protocols for mining equipment, processing facilities, and industrial environments. The lack of any OpenWorks presence despite 19,000+ locations nationwide signals this is not a natural outsourcing market - mining operations rarely outsource facilities management as it's integral to safety and operations."
2131,Support Activities for Mining,35,"Mining support activities (equipment maintenance, exploration services, drilling) represent heavy industrial environments with specialized safety requirements, hazardous materials handling, and technical cleaning needs beyond standard commercial services. These facilities typically have internal maintenance teams due to the operational complexity and safety protocols required in mining operations. The industry also faces cyclical volatility tied to commodity prices, and the operational nature suggests low likelihood of outsourcing facility maintenance as a non-core function."
2211,"Electric Power Generation, Transmission and Distribution",42,"Despite OpenWorks presence, the extremely low revenue per building ($1,613/building annually, ~$134/month) indicates this is a DIFFICULT market with specialized requirements beyond standard commercial cleaning. Electric utilities typically have internal facilities teams, union staff, and technical/safety requirements (substations, power plants, control rooms) that don't align with OpenWorks' core commercial cleaning competency. The minimal revenue despite serving 3 locations signals poor strategic fit - this is operational/industrial infrastructure, not the multi-location retail/education/healthcare facilities where OpenWorks excels."
2212,NAICS 2212 Industry,25,"NAICS 2212 covers natural gas distribution utilities - a highly regulated infrastructure industry with specialized safety requirements, technical operations, and typically internal facilities management teams. These are not multi-location retail/operational facilities but rather utility infrastructure (pipelines, compressor stations, metering facilities) requiring specialized maintenance beyond standard commercial cleaning. The lack of OpenWorks presence and the technical/industrial nature of utility operations makes this a poor strategic fit."
2213,"Water, Sewage and Other Systems",35,"Despite OpenWorks presence, the extremely low revenue per building ($1,634/building annually = $136/month) indicates this is a DIFFICULT market with minimal cleaning needs or pricing power. Water/sewage treatment facilities are operational/industrial environments that likely have internal maintenance staff and specialized cleaning requirements beyond standard commercial services. The poor revenue quality despite presence signals this is not a strategic growth opportunity."
2361,Residential Building Construction,25,"Residential construction companies are poor fits for OpenWorks' multi-location commercial cleaning model. These are typically project-based businesses with temporary job sites rather than permanent facilities requiring ongoing cleaning services, and construction site cleaning has specialized requirements (debris removal, post-construction cleanup) that differ from OpenWorks' core commercial facility maintenance competency. The lack of any OpenWorks presence despite 576K+ locations nationwide signals this is not a viable market - construction companies don't outsource ongoing facility cleaning because they don't operate traditional commercial facilities."
2362,Nonresidential Building Construction,35,"Construction companies are project-based operations with temporary job sites and field offices, not permanent multi-location facilities requiring ongoing cleaning contracts. The extremely low revenue per building ($3,362/year or ~$280/month) despite OpenWorks presence confirms this is a difficult market with minimal recurring revenue potential. Construction firms typically handle their own site cleanup or use specialized post-construction cleaning services, making this a poor strategic fit for OpenWorks' recurring commercial cleaning model."
2371,Utility System Construction,45,"Utility System Construction involves specialized construction sites (power lines, pipelines, water/sewer systems) with temporary, project-based facilities rather than permanent multi-location operations. These are field construction environments with heavy equipment, outdoor work sites, and transient project offices - not the standardized commercial facilities where OpenWorks excels. The industry lacks centralized facility management, has specialized safety/environmental requirements beyond standard cleaning, and doesn't fit the multi-location retail/education/operational facility profile that drives OpenWorks success."
2372,NAICS 2372 Industry,35,"NAICS 2372 (Land Subdivision) represents land development and real estate subdivision activities - essentially preparing raw land for construction. This is a poor fit for OpenWorks as these are temporary project sites without permanent facilities requiring ongoing cleaning services. The industry involves outdoor construction/development work rather than the multi-location operational facilities where OpenWorks succeeds, and cleaning needs would be minimal, sporadic, and construction-related rather than commercial facility maintenance."
2373,"Highway, Street, and Bridge Construction",25,"Highway and bridge construction represents a poor strategic fit for OpenWorks. This is a heavy industrial/construction sector with transient project sites rather than permanent multi-location facilities, specialized equipment cleaning needs beyond standard commercial services, and field operations that rarely outsource cleaning as a distinct service. The industry lacks the key success factors: permanent consumer-facing facilities, centralized procurement for multi-location chains, and standard commercial cleaning requirements that OpenWorks excels at serving."
2379,NAICS 2379 Industry,35,"NAICS 2379 covers 'Other Heavy and Civil Engineering Construction' including power/communication line construction, land subdivision, and other infrastructure projects. These are construction/project-based operations with temporary job sites, specialized outdoor work environments, and field crews rather than permanent facilities requiring regular commercial cleaning. This is a poor fit for OpenWorks' multi-location facility maintenance model - construction companies need occasional trailer/office cleaning, not ongoing facility services contracts."
2381,"Foundation, Structure, and Building Exterior Contractors",25,"Foundation and building exterior contractors are construction/specialty trade businesses that perform project-based work (masonry, concrete, framing, roofing, siding) rather than operating facilities requiring ongoing cleaning services. These are typically small contractors with job site trailers or small offices, not multi-location facilities with standardized cleaning needs. This industry represents construction service providers, not facility operators - fundamentally misaligned with OpenWorks' commercial cleaning business model."
2382,Building Equipment Contractors,35,"Building Equipment Contractors (HVAC, plumbing, electrical contractors) are themselves service providers who work on-site at client facilities rather than operating multi-location facilities requiring cleaning. The extremely low revenue per building ($1,984/year or ~$165/month) despite OpenWorks presence confirms this is a DIFFICULT market - likely small contractor offices/shops with minimal cleaning needs. These are typically small businesses without centralized procurement, and cleaning is not a meaningful expense category for trade contractors focused on their own service delivery."
2383,Building Finishing Contractors,25,"Building finishing contractors (drywall, painting, flooring, tile installation) are construction trade businesses, not facility operators requiring ongoing cleaning services. The extremely low revenue per building ($570/year or ~$48/month) despite OpenWorks presence confirms this is a poor fit - these are likely small contractor offices or warehouses with minimal cleaning needs. This is a B2B construction services industry, not a multi-location facility operator that outsources cleaning as a non-core function."
2389,Other Specialty Trade Contractors,25,"This is a highly fragmented industry of specialty trade contractors (scaffolding, wrecking, steeplejacks, etc.) - essentially construction subcontractors who are NOT multi-location operators and do NOT fit OpenWorks' ideal customer profile. The $299 revenue from 1 building indicates minimal engagement, not proven success. These are small, project-based businesses with temporary job sites rather than permanent facilities requiring ongoing cleaning services."
3111,NAICS 3111 Industry,35,"NAICS 3111 (Animal Food Manufacturing) is a process manufacturing industry involving grain processing, feed mills, and pet food production - environments with specialized food safety requirements, heavy machinery, and production-focused operations. Manufacturing facilities typically have internal maintenance teams and specialized cleaning protocols beyond standard commercial services. With no OpenWorks presence and the industry's process manufacturing characteristics, this represents a difficult market with low outsourcing likelihood and poor strategic fit."
3112,NAICS 3112 Industry,42,"NAICS 3112 (Grain & Food Processing) is explicitly flagged as EXCLUDE with a cap of 40 due to specialized food safety requirements, heavy industrial environments, and process industry characteristics. Despite OpenWorks having 2 locations generating $17K revenue, this represents a difficult market with specialized cleaning needs beyond standard commercial services. The food processing environment requires specialized protocols and equipment that don't align with OpenWorks' core multi-location retail/education/operational facility model."
3113,NAICS 3113 Industry,35,"NAICS 3113 covers sugar and confectionery product manufacturing - a process manufacturing industry with specialized food safety requirements, production equipment, and likely internal facilities teams. Food processing plants typically have complex cleaning protocols beyond standard commercial services, and the lack of any OpenWorks presence despite 4,564+ locations nationwide signals this is a difficult market to penetrate. Manufacturing environments with production machinery and specialized sanitation requirements fall outside OpenWorks' core competency of standard commercial cleaning."
3114,NAICS 3114 Industry,35,"NAICS 3114 covers seafood product preparation and packaging, which is process manufacturing with specialized food safety requirements (HACCP, FDA regulations) and cold/wet environments requiring technical cleaning protocols beyond standard commercial services. This is a manufacturing environment with production lines, processing equipment, and specialized sanitation needs that don't align with OpenWorks' core competency in standard commercial cleaning. The industry also typically has internal facilities teams or uses specialized food-grade sanitation contractors, making outsourcing to general commercial cleaners unlikely."
3115,NAICS 3115 Industry,38,"NAICS 3115 (Dairy Product Manufacturing) is a process manufacturing industry with specialized food safety requirements, sanitation protocols, and likely internal facilities teams - all indicators of poor fit. Despite minimal OpenWorks presence (1 building, $3,913 revenue), the low revenue per building and manufacturing nature signal this is a difficult market requiring specialized cleaning beyond standard commercial services. Process food manufacturing consistently underperforms for OpenWorks due to technical requirements and low outsourcing likelihood."
3116,Animal Slaughtering and Processing,42,"Food processing/animal slaughtering is a specialized industrial environment with USDA/food safety requirements beyond standard commercial cleaning. Despite minimal OpenWorks presence ($6,515 from 1 building), the low revenue per building and specialized sanitation protocols (pathogen control, temperature-controlled environments, regulatory compliance) indicate this is a difficult market requiring expertise beyond core competency. Process manufacturing with heavy industrial characteristics and specialized requirements caps the score."
