naics_code,description,icp_fit_score,reasoning
1111,NAICS 1111 Industry,15,"NAICS 1111 covers Oilseed and Grain Farming - agricultural operations with minimal facility cleaning needs beyond basic farm buildings and equipment storage. These are typically single-location family farms or agricultural operations that handle their own maintenance, with no pattern of outsourcing commercial cleaning services. The agricultural nature, lack of multi-location operators, and absence of any OpenWorks presence confirms this is outside the core commercial/industrial facility cleaning market."
1112,NAICS 1112 Industry,25,"NAICS 1112 covers cattle ranching and feedlots - agricultural operations that typically handle their own facility maintenance as part of core operations. These are owner-operated farms/ranches with minimal commercial cleaning needs, no multi-location centralized decision-making, and cleaning is integrated into daily agricultural work rather than outsourced as a non-core function. The complete absence of OpenWorks presence despite 910 locations nationwide confirms this industry does not outsource commercial cleaning services."
1113,NAICS 1113 Industry,25,"NAICS 1113 covers fruit and tree nut farming - agricultural operations with minimal facility cleaning needs beyond basic farm buildings and packing sheds. These are owner-operated agricultural businesses focused on crop production, not multi-location facility operators requiring commercial cleaning services. Zero OpenWorks presence confirms this is outside core competency - agricultural facilities have specialized cleaning needs (if any) that don't align with OpenWorks' commercial cleaning model."
1114,NAICS 1114 Industry,25,"NAICS 1114 covers greenhouse, nursery, and floriculture production - agricultural operations with specialized growing environments. These facilities have unique cleaning needs (plant health considerations, humidity control, growing media management) that fall outside OpenWorks' core commercial cleaning competency. Zero current presence despite 9,171 locations nationwide signals this industry keeps facilities management in-house or requires agricultural expertise rather than standard commercial cleaning services."
1119,NAICS 1119 Industry,35,"NAICS 1119 covers 'Other Crop Farming' including tobacco, hay, peanuts, and specialty crops - primarily agricultural operations with outdoor fields, barns, and minimal commercial building infrastructure. These are farming operations where cleaning is not a relevant outsourced service (focus is on agricultural production, not facility maintenance), and the 55,644 locations are predominantly small family farms rather than multi-location commercial operators. Zero OpenWorks presence confirms this is not a cleaning services market - agricultural facilities have fundamentally different needs than commercial buildings."
1121,NAICS 1121 Industry,25,"NAICS 1121 covers cattle ranching and farming operations - agricultural facilities with minimal commercial cleaning needs and extremely low outsourcing likelihood. These are owner-operated farms/ranches focused on livestock production, not multi-location businesses with standard facility maintenance requirements. Zero OpenWorks presence confirms this industry does not outsource cleaning services - facilities are utilitarian barns/pastures managed by farm staff, making this a poor strategic fit."
1122,NAICS 1122 Industry,25,"NAICS 1122 covers hog and pig farming operations - agricultural facilities with highly specialized cleaning needs (biosecurity protocols, USDA regulations, animal waste management) that fall far outside OpenWorks' core commercial cleaning competency. These are typically single-location family farms or corporate farming operations with internal staff handling facility maintenance, not multi-location businesses that outsource standard commercial cleaning. Zero OpenWorks presence confirms this is not a viable market - agricultural facilities require specialized agricultural services, not commercial janitorial companies."
1123,NAICS 1123 Industry,25,"NAICS 1123 covers poultry and egg production - agricultural operations (farms, hatcheries, processing facilities) that require specialized cleaning protocols for biosecurity, USDA compliance, and disease prevention. These facilities typically have internal staff for specialized agricultural sanitation needs rather than outsourcing to commercial cleaning companies, and the technical requirements (disinfection protocols, biosecurity measures) fall outside OpenWorks' core competency of standard commercial cleaning."
1124,Sheep and Goat Farming,25,"NAICS 1124 (Sheep and Goat Farming) represents agricultural operations with minimal commercial cleaning needs - primarily outdoor facilities, barns, and livestock areas requiring specialized agricultural maintenance rather than standard commercial cleaning services. With only 275 total locations nationwide and zero OpenWorks presence, this indicates extremely poor fit: farming operations handle their own facility maintenance, have no multi-location centralized decision-making structure, and require agricultural expertise rather than commercial cleaning services. This is fundamentally outside OpenWorks' core competency and ideal customer profile."
1125,NAICS 1125 Industry,35,"NAICS 1125 covers aquaculture operations (fish farms, shellfish farms, hatcheries), which are highly specialized agricultural/industrial facilities with unique sanitation and biosecurity requirements beyond standard commercial cleaning. With only 2,408 locations nationwide and zero OpenWorks presence, this represents a niche market with specialized needs (water quality, disease prevention protocols, USDA/FDA compliance) that don't align with OpenWorks' core commercial cleaning competencies. The lack of any proven success despite operational facility characteristics suggests these businesses either handle cleaning internally or require specialized agricultural service providers."
1129,NAICS 1129 Industry,35,"NAICS 1129 covers 'Other Animal Production' including apiculture, aquaculture, fur-bearing animals, and specialty livestock. These are agricultural operations with highly specialized facility needs (barns, hatcheries, processing areas) that require agricultural expertise rather than standard commercial cleaning. Zero OpenWorks presence despite 17,455 locations signals poor outsourcing fit - these owner-operated farms typically handle their own facility maintenance as part of core operations."
1131,Timber Tract Operations,25,NAICS 1131 (Timber Tract Operations) represents forestry/logging operations with minimal facility infrastructure - primarily outdoor operations with limited commercial cleaning needs. The extremely small market size (177 locations nationwide) and specialized outdoor/industrial nature makes this a poor strategic fit. These operations typically have field offices or minimal facilities that don't align with OpenWorks' multi-location commercial cleaning model.
1132,Forest Nurseries and Gathering of Forest Products,35,"NAICS 1132 (Forest Nurseries and Gathering of Forest Products) represents outdoor agricultural/forestry operations with minimal facility infrastructure - primarily nurseries, tree farms, and forest product gathering operations. These are not multi-location commercial facilities requiring standard cleaning services; they're outdoor operations with limited building footprints and specialized agricultural needs outside OpenWorks' core competency. The tiny market size (179 locations nationwide) and lack of any OpenWorks presence confirms this is not a viable commercial cleaning market."
1133,NAICS 1133 Industry,35,"NAICS 1133 covers logging operations - outdoor forestry activities with minimal facility infrastructure beyond equipment storage and small field offices. This industry has virtually no commercial cleaning needs (outdoor work sites, not traditional facilities), represents a poor fit for OpenWorks' core commercial cleaning services, and zero current presence confirms logging operations don't outsource facility maintenance as they lack substantial facilities to maintain."
1141,NAICS 1141 Industry,25,"NAICS 1141 covers fishing operations (commercial fishing, shellfish fishing, finfish fishing), which are highly specialized marine/aquatic operations with minimal facility footprints and unique operational requirements. These are not multi-location businesses with standard commercial cleaning needs - they operate vessels, docks, and processing facilities requiring specialized maritime/food safety protocols beyond OpenWorks' core competency. The tiny market size (616 locations nationwide) and zero OpenWorks presence despite being operational businesses confirms this is not a viable target market."
1142,NAICS 1142 Industry,35,"NAICS 1142 covers Hunting and Trapping operations - primarily individual operators, hunting preserves, and game management services. This industry has extremely poor fit: facilities are typically outdoor/rural (minimal cleaning needs), operations are seasonal/small-scale, and there's zero OpenWorks presence despite 7,232 locations nationwide (strong signal of non-outsourcing). These are not multi-location commercial facilities requiring standard janitorial services."
1151,NAICS 1151 Industry,35,"NAICS 1151 covers Support Activities for Crop Production (farm labor contractors, soil preparation, crop harvesting services). These are agricultural support operations with outdoor/field-based work, seasonal labor patterns, and minimal facility footprints requiring commercial cleaning. The zero OpenWorks presence despite 14,000+ locations signals poor outsourcing fit - agricultural operations typically don't outsource facility cleaning as they have minimal indoor facilities and focus on field operations rather than building maintenance."
1152,NAICS 1152 Industry,35,"NAICS 1152 covers Cattle Ranching and Farming - agricultural operations with minimal commercial cleaning needs beyond basic barn/facility maintenance. These are typically owner-operated or small family businesses without multi-location structures, and cleaning is handled internally as part of daily operations rather than outsourced as a non-core function. Zero OpenWorks presence confirms this industry does not align with commercial facility maintenance services."
1153,NAICS 1153 Industry,35,"NAICS 1153 covers support activities for forestry, including forest nurseries, timber tract operations, and forestry consulting. These are highly specialized outdoor/field operations with minimal traditional commercial cleaning needs - facilities are typically small field offices or outdoor nurseries requiring specialized maintenance rather than standard commercial cleaning services. Zero OpenWorks presence despite 6,341 locations signals this industry does not outsource cleaning in a way that fits OpenWorks' core competency."
2111,Oil and gas extraction operations,35,"Oil and gas extraction operations present significant challenges for OpenWorks' standard commercial cleaning model. These facilities require specialized safety protocols, hazmat training, remote locations, and often have internal maintenance teams due to operational integration needs. Zero current OpenWorks presence despite 13,000 locations nationwide is a strong signal that this industry either doesn't outsource cleaning or requires capabilities beyond OpenWorks' core competency in standard commercial facilities."
2121,Coal Mining,35,"NAICS 2121 (Coal Mining) represents a poor strategic fit for OpenWorks. Mining operations require specialized industrial cleaning protocols, hazardous material handling, and safety certifications beyond standard commercial cleaning capabilities. The small market size (762 locations nationwide) combined with highly specialized requirements, remote locations, and likely internal facilities teams make this an unattractive target market with minimal outsourcing potential."
2122,Metal ore mining operations,35,"Metal ore mining operations present significant challenges for OpenWorks' standard commercial cleaning model. These are highly specialized industrial facilities requiring mining-specific safety protocols, hazmat handling, and technical cleaning beyond core competencies. The extremely small market size (246 locations nationwide) combined with remote locations, specialized requirements, and likely internal facilities teams make this a poor strategic fit despite being operational facilities."
2123,Nonmetallic Mineral Mining,45,"Nonmetallic mineral mining (quarries, sand/gravel pits, stone mining) presents moderate challenges for OpenWorks. While these are operational facilities that could outsource cleaning for offices, break rooms, and administrative buildings, the industry involves heavy industrial environments with specialized cleaning needs (dust control, equipment cleaning, safety protocols) that go beyond standard commercial cleaning. Zero OpenWorks presence despite 19,000+ locations suggests either limited outsourcing culture or requirements that don't align with core competencies - mining operations typically handle facility maintenance internally as part of site operations."
2131,Support Activities for Mining,45,"Support Activities for Mining includes operational facilities like equipment maintenance yards, supply depots, and field offices that could theoretically outsource cleaning. However, the complete absence of OpenWorks presence despite 25,000+ locations nationwide is a strong RED FLAG - these facilities are likely remote/field-based with minimal cleaning needs, have internal maintenance staff, or operate in harsh industrial environments requiring specialized protocols beyond standard commercial cleaning. The lack of proven success suggests poor outsourcing likelihood and challenging operational fit."
2211,"Electric Power Generation, Transmission and Distribution",72,"Electric utilities operate operational facilities (power plants, substations, transmission facilities) where cleaning is a non-core support function, fitting OpenWorks' operational facility strength. The proven success ($4,840 revenue, 3 buildings) demonstrates outsourcing likelihood in this sector, though the low revenue-per-building ($1,613) suggests smaller facilities or limited scope. Score boosted to 72 from base ~60 due to proven presence, operational nature of facilities, and multi-location utility operators, though growth potential may be constrained by specialized technical areas and some utilities having internal maintenance teams."
2212,NAICS 2212 Industry,35,"Natural gas distribution utilities typically operate critical infrastructure with specialized safety requirements, regulatory compliance needs, and often maintain internal facilities teams for their operational facilities and offices. Zero OpenWorks presence despite 12,800 locations nationwide is a strong signal that this industry either doesn't outsource cleaning or has specialized requirements beyond standard commercial cleaning. The utility sector generally has sophisticated internal operations departments and union considerations that make outsourcing less likely."
2213,"Water, Sewage and Other Systems",72,"Water/sewage utilities operate essential infrastructure facilities (treatment plants, pumping stations, administrative offices) that require consistent cleaning as a non-core function. While OpenWorks has proven success with 2 locations generating $3,267 revenue, the industry presents moderate complexity due to industrial/operational environments and potential municipal ownership with procurement processes. The 19,966 locations nationwide offer scale, but many are small municipal operations - best opportunities are multi-facility regional utilities and water districts that outsource facility maintenance."
2361,Residential Building Construction,25,"Residential construction companies are poor-fit prospects for OpenWorks. These are project-based businesses with temporary job sites (not permanent facilities), highly fragmented single-location operators, and cleaning needs focused on post-construction cleanup rather than ongoing facility maintenance. The complete absence of OpenWorks revenue despite 576K+ locations nationwide is a strong signal that this industry does not outsource commercial cleaning services in a way that aligns with OpenWorks' recurring facility maintenance model."
2362,Nonresidential Building Construction,45,"Construction companies present significant challenges despite minimal OpenWorks presence ($6,723 revenue). These are project-based businesses with temporary job sites rather than permanent multi-location facilities, and construction firms typically handle their own site cleanup or use specialized post-construction cleaning services. The low revenue per building ($3,362) and only 2 locations served suggests these may be construction company offices rather than job sites, indicating limited scalability in this sector."
2371,Utility System Construction,65,"Utility System Construction represents operational/industrial facilities (field offices, equipment yards, maintenance facilities) where cleaning is a non-core function - strong alignment with OpenWorks' operational facility success. However, zero current presence despite 61K+ locations suggests either highly fragmented single-location contractors or project-based temporary facilities that don't fit the multi-location model. Score reflects potential fit for larger utility contractors with permanent regional facilities, but lack of proven success and likely prevalence of small/mobile operations warrants caution until market structure is better understood."
2372,Land Subdivision,35,"NAICS 2372 (Land Subdivision) represents land development and real estate subdivision activities - primarily outdoor/field operations with minimal facility cleaning needs. This industry involves land preparation, lot development, and infrastructure installation rather than operating buildings requiring commercial cleaning services. Zero OpenWorks presence despite 35K+ locations signals this is not a facility-intensive industry where cleaning services are needed or outsourced."
2373,"Highway, Street, and Bridge Construction",35,"Highway and bridge construction involves temporary job sites, mobile field operations, and project-based work rather than permanent multi-location facilities requiring ongoing cleaning services. These are outdoor construction environments with trailers/temporary offices, not the operational facilities where OpenWorks succeeds. Zero current presence despite 55K+ locations signals this industry doesn't outsource facility cleaning in a way that fits OpenWorks' service model - construction companies focus on project sites, not maintaining permanent facilities."
2379,Other Heavy and Civil Engineering Construction,35,"NAICS 2379 (Other Heavy and Civil Engineering Construction) covers specialized construction projects like power lines, pipelines, and communication infrastructure - typically project-based work at temporary job sites rather than permanent multi-location facilities requiring ongoing cleaning services. Zero OpenWorks presence despite 29,635 locations nationwide is a strong signal that this industry doesn't outsource facility cleaning in a way that fits OpenWorks' model, as construction companies focus on project sites rather than maintaining permanent operational facilities. The transient, project-based nature and lack of standardized multi-location facilities makes this a poor strategic fit."
2381,"Foundation, Structure, and Building Exterior Contractors",25,"Foundation and building exterior contractors are construction/trade businesses focused on specialized technical work (foundations, framing, siding, roofing) as their core service - not facility operations requiring cleaning. These are typically project-based contractors working at construction sites rather than operating permanent multi-location facilities with ongoing cleaning needs. Zero OpenWorks presence despite 235K+ locations signals this industry does not outsource commercial cleaning services, as their own facilities (offices, equipment yards) are minimal and cleaning is not a priority operational need."
2382,Building Equipment Contractors,45,"Building Equipment Contractors (HVAC, plumbing, electrical contractors) are primarily small trade businesses operating from modest offices/warehouses, not multi-location operators requiring significant cleaning services. The $1,984/building revenue and only 13 locations served despite 527K+ nationwide locations suggests these are typically owner-operated shops with minimal facility needs. While OpenWorks has some presence, this industry lacks the multi-location operational facilities profile that drives OpenWorks' core success - these are service providers themselves, not the operational/industrial facility operators where OpenWorks excels."
2383,Building Finishing Contractors,35,"Building Finishing Contractors (drywall, painting, flooring, tile) are construction trade businesses, not facility operators needing ongoing cleaning services. The minimal revenue ($1,709 across 3 locations) suggests these are likely small contractor offices rather than operational facilities, and this industry doesn't align with OpenWorks' core model of serving multi-location facility operators with recurring cleaning needs. Construction contractors typically handle their own site cleanup and have minimal office space requiring janitorial services."
2389,Other Specialty Trade Contractors,45,"This is a highly fragmented category of specialty trade contractors (site preparation, building equipment, other construction trades) who typically operate from small offices or yards rather than large operational facilities. Despite minimal OpenWorks presence ($299 from 1 location), these are construction/trade businesses that likely prioritize field operations over facility maintenance and rarely have multiple substantial facilities requiring outsourced cleaning. The low revenue per building and single location served suggests this is not a strategic growth opportunity despite the large nationwide footprint."
3111,NAICS 3111 Industry,35,"Animal Food Manufacturing (3111) presents significant challenges for OpenWorks. These facilities require specialized cleaning protocols for food safety compliance (FDA/USDA regulations), pest control expertise, and often have internal facilities teams to manage regulatory requirements. The complete absence of OpenWorks presence despite 3,553 locations nationwide is a strong signal that this industry either handles cleaning internally or requires specialized food-grade sanitation beyond standard commercial cleaning capabilities."
3112,Grain & Oilseed Milling,62,"NAICS 3112 (Grain & Oilseed Milling) shows proven OpenWorks success with $17K revenue and 2 buildings served, demonstrating outsourcing viability in this operational/industrial sector. However, the industry presents moderate challenges: facilities may have specialized food safety/sanitation requirements beyond standard commercial cleaning, and the 2,418 total US locations limit scalability compared to higher-volume industries. The proven success earns a +5 bonus and minimum score of 55, but specialized food processing protocols and limited location count prevent a higher rating despite the operational facility fit."
3113,Sugar and Confectionery Product Manufacturing,35,"NAICS 3113 (Sugar and Confectionery Product Manufacturing) represents food manufacturing facilities with specialized sanitation requirements including FDA compliance, allergen control, and food-grade cleaning protocols that exceed standard commercial cleaning capabilities. Zero OpenWorks presence despite 4,564 locations signals this industry maintains internal sanitation teams or uses specialized food-safety cleaning contractors. Manufacturing environments typically don't outsource cleaning as a non-core function when product quality and regulatory compliance depend on sanitation protocols."
3114,NAICS 3114 Industry,35,"NAICS 3114 covers Fruit and Vegetable Preserving and Specialty Food Manufacturing, which includes facilities with specialized food safety requirements (HACCP, FDA compliance) and sanitation protocols beyond standard commercial cleaning. Zero OpenWorks presence despite 3,104 locations nationwide is a strong signal that this industry either maintains internal sanitation teams or requires specialized food-grade cleaning services that fall outside OpenWorks' core competency. The manufacturing nature and regulatory complexity make this a poor strategic fit."
3115,Dairy Product Manufacturing,45,"NAICS 3115 (Dairy Product Manufacturing) involves specialized food processing facilities with stringent FDA/USDA sanitation requirements, cleanroom protocols, and technical cleaning standards that exceed standard commercial cleaning capabilities. While OpenWorks has minimal presence ($3,913 from 1 location), this likely represents administrative offices rather than production facilities. The specialized nature of dairy manufacturing (sanitation protocols, temperature controls, food safety compliance) makes this a poor strategic fit despite the proven revenue, as scaling would require specialized expertise beyond OpenWorks' core competency in standard commercial cleaning."
